,title,author,publisher,journal,date,translate_title,Abstract,,,
181,고창 봉덕리 1호분의 고고학적 위상 - 영산강유역 방대형 고분과의 비교를 통해 -,이문형,원광대학교 마한백제문화연구소,마한백제문화,2020,고창 봉덕리 1호분의 고고학적 위상 - 영산강유역 방대형 고분과의 비교를 통해 -,"전라북도의 최남단에 위치한 고창지역은 최근 고고학계에서 가장 주목받고 있는 지역 중의 한 곳이다. 고창지역은 서쪽으로 바다를 접하고 동쪽으로는 호남정맥이 남쪽으로 분기하면서 높은 산악지형을 형성하여 전라남도와 경계를 이루고 있다. 이러한 폐쇄적이면서도 독립적인 독특한 지형으로 고창지역은 전북과 전남을 연결하는 중요한 길목에 자리하고 있다. 특히 고고학에 있어서 충청 혹은 전북지역과 영산강유역을 연결하는 중요 거점지역으로 인식되고 있다. 이와 같은 지정학적 위치로 고창지역은 영산강유역과 동일하게 분구묘 분형의 변화상이 관찰되며 그 마지막 정점에 방대형 고총인 봉덕리 1호분이 있다. 따라서 고창 봉덕리 1호분과 영산강유역 방대형 고분과의 관계를 검토하고 상호 연관성에 대해 파악하고자 한다. 먼저 Ⅱ장에서는 봉덕리 1호분과 영산강유역 방대형 고분의 현황을 정리하였다. Ⅲ장에서는 Ⅱ장의 내용을 토대로 영산강유역의 방대형 고분과의 비교 검토를 실시하였다. 비교 검토는 입지와 분구, 매장시설 등으로 세분화하여 실시하였다. 이를 통해 영산강유역 옥야리 방대형 1호분은 기존 인식한 방대형 고분 출현과 직접적인 관련성은 희박하며, 영산강유역의 재지전통인 ‘다장-분구의 확장-주구’ 등의 분구속성이 발현된 고창 봉덕리 1호분에서 그 관련성을 찾을 수 있다. Ⅳ장에서는 봉덕리 1호분 축조세력의 위상을 독창성과 우월성이라는 측면에서 검토하였다. 독창성은 백제 중앙세력과의 관계 하에서 ‘고창식 고배’ 라는 재지계 속성이 강한 토기에서 그 해답을 찾을 수 있다. 우월성은 고창 봉덕리 1호분과 영산강유역의 대형 분구묘의 분구 규모에 따른 노동력을 산출한 결과, 상대적으로 봉덕리 1호분의 축조세력의 위상을 확인하였다. 산출 결과를 토대로 기존의 연구 성과에 대입해본 결과 봉덕리 1호분 분구 조성에 참여한 취락은 반경 20㎞을 넘어설 것으로 판단된다.",,,
182,미얀마 바간 문화유산 ODA 사업과 파야똔주 사원 발굴조사의 고고학적 의의,"전범환, 김용준",서강대학교 동아연구소,동아연구,2020,미얀마 바간 문화유산 ODA 사업과 파야똔주 사원 발굴조사의 고고학적 의의,"2013년부터 본격적으로 시작된 한국의 문화유산 분야 ODA 사업은 아직 10년이 채 되지 않은 초보적인 단계에 있다. 1980년대 이전부터 이 분야 사업을 진행했던 일본 등 다른 국가들에 비해 한국은 늦게 시작하였다. 새로운 분야의 업무를 그것도 다른 나라에서 진행하는 것은 쉬운 일은 아니다. 한국은 어렵게 시작한 문화유산 분야 ODA 사업의 기초를 다지고 있는 중이며, 한국문화재재단이 그 중심에 있다. 한국문화재재단은 한국에서 진행하고 있는 문화유산 분야 ODA 사업의 대부분을 진행하고 있는 대표적인 기관이다. 현재 미얀마, 라오스, 캄보디아에서 동시에 사업이 진행되고 있다. 그 중 미얀마에서 진행되고 있는 사업은 다른 국가에서 진행하고 있는 크메르 유적의 보존복원과 달리 우리가 쉽게 접할 수 없었던 벽돌 건축물과 관련된 것으로 바간(Bagan) 파야똔주 사원(Phaya-Thone-Zu Temple)에서 진행되고 있다. 이제 2년차의 기초조사가 진행되고 추후 벽화에 대한 보존처리가 진행될 미얀마 바간에서 한국 팀은 기존에 시도되지 않았던 새로운 융‧복합적(multi-disciplinary) 접근을 시도하고 있다. 2019년 진행된 파야똔주 발굴조사에서는 기존 바간 지역 고고학조사에서는 처음인 담장이 지하에서 노출되었고 현재 지상에 잔존하는 담장들과 연결되는 13세기 또는 그 이전 시기의 구조물이 파야똔주 하부에 자리하고 있음을 밝혀냈다. 현장에서 수습된 목탄의 연대측정 등 과학적인 분석이 조사결과와 종합적으로 고찰된다면 파야똔주 사원의 건립과 그 이전 시기 건축물의 관계가 조금씩 밝혀질 것으로 기대된다.",,,
183,5세기 후엽~6세기 전엽 고고학적 자료를 통해 본 백제의 친왜정책 의미,우재병,한국고대학회,선사와 고대,2020,5세기 후엽~6세기 전엽 고고학적 자료를 통해 본 백제의 친왜정책 의미,"5세기 후엽~6세기 전엽경 백제 서해안 항로상의 죽막동 제사유적에서는 백제 양식 제사 거행이 매우 활발해졌다. 이 시기 주목되는 또 하나의 제사 양상은 갑옷, 나이프, 낫 등을 형상화한 소형 석제 모조품의 등장이다. 이 왜 양식 제사는 6세기 전엽경 가장 활발하게 이루어진 것으로 보이며, 왜인의 죽막동 제사 참여를 의미하는 고고학적 자료로 평가된다. 또한 5세기 후엽경부터는 수장묘 분구 상에 원통형토기를 장식하는 왜의 무덤 양식도 백제 서남부지역에서 채용되기 시작하였다. 이 양상은 6세기 전엽경에 최고조에 달한다. 이 시기가 되면, 분구 위에 원통형토기 장식을 시행하는 것뿐만 아니라 전방후원분이라는 왜의 최고위급 무덤 양식까지도 채용하는 양상이 목격된다. 필자는 이 시기 백제의 최상위급 해안 제사유적과 최상위급 수장묘에서 관찰되는 왜 양식 제사 거행 흔적과 왜의 무덤양식 채용 흔적은 우연의 일치로 볼 수 없다고 판단한다. 그리고 이들 왜 양식 제사 거행과 왜의 무덤 양식 채용은 지방 수장 차원에서 시행한 정책은 아니라고 확신한다. 당시 백제의 외교적 역량과 위계화된 사회구조를 고려하면, 백제 중앙의 주도 혹은 관여에 의해 시행된 정책이라고 할 수 있다. 백제 중앙과 지방이 함께 강화된 친왜정책을 추진한 배경에는 고구려에 의한 서울지역 수도 함락이라는 국가적 위기를 극복하려는 공동의 목표가 있었다고 판단된다. 6세기 전엽 백제 중앙의 친왜정책 강화의 계기는, 고구려의 공세를 저지하기 위해 왜와의 외교적 연대 강화가 필요한 상황 속에서, 무령정권과 왜 게이타이(繼體)정권 사이의 긴밀한 친연관계가 크게 작용하였기 때문일 수도 있다. 또 하나의 계기는 고구려에 의해 백제가 점령되는 상황을 우려한 왜가 고구려의 파상 공세를 저지할 목적을 가지고 친백제외교를 강화하였기 때문일 수도 있다. 왜 게이타이(繼體)정권이 당시 백제 무령정권 보다 더욱 강력한 친백제정책을 시행한 것도 백제의 위기 극복이 왜의 생존‧번영에 직결된다는 정치적 판단에 기인한 것으로 평가할 수 있다.",,,
184,한국 고대 제철기술의 고고학적 연구 : 영남지역을 중심으로,김권일,한국지식재산연구원,한국지식재산연구원 도서DB,2020,한국 고대 제철기술의 고고학적 연구 : 영남지역을 중심으로,,,,
185,"中學校 自由學期, 年制 敎育과 考古學의 만남 -貝塚遺蹟 活用 敎育 프로그램 開發을 中心으로-","김경택, 정수민",호서고고학회,호서고고학,2020,"중학교 자유학기, 연제 교육과 고고학의 만남 -패총유적 활용 교육 프로그램 개발을 중심으로-","문화유산에 관한 대중적 관심이 증대되면서 문화유산의 보존과 활용에 대한 인식 역시 높아지고 있다. 특히 대중고고학(Public Archaeology)이라는 새로운 패러다임이 도입된 고고학계에는 학술적 측면 이외에 ‘사회적 활용’ 측면이 강조되고 있다. 공·사립박물관과 매장문화재조사기관은 다양한 교육 프로그램을 운영하며, 문화유산 분야로의 대중의 참여를 적극적으로 유도하고 있다. 그러나 지역의 사회문화적 환경에 따라 문화유산 향유의 기회가 상이하고, 문화유산 교육에의 접근 기회 역시 심한 편차가 있다. 필자들은 2015년 시작된 ‘자유학기제’ 교육 프로그램을 활용하여 고고학과 학교교육과의 연계 가능성에 주목하였다. 공교육의 교육적 보편성과 자유학기·년제 수업의 특성, 고고학이 지닌 교육적 가치를 결합하여 총 17차시의 패총유적 활용 고고학 교육 프로그램을 개발하였다. 현직 중학교 교사의 자문과 분석을 받아 프로그램의 학교교육 체제에서의 실현 가능성을 검토하였다. 수업 시연 및 프로그램 적용을 통한 결과를 도출하진 못했지만, 평가와 분석을 통해 실현 가능성을 상정해 볼 수 있었다. 지역 환경에 따른 교육 기회의 불균형을 해소하고 체계적인 문화유산 교육 프로그램 개발의 방향을 제기했다는 점에서 본 연구의 의미를 찾고 싶다. 진정한 의미의 대중고고학 실현을 위해 향후 보다 나은 교육 프로그램을 개발하고자 한다.",,,
186,영남지방 목관묘 출토 전기와질토기 편년- 原史考古學의 基礎硏究 -,이원태,영남고고학회,영남고고학,2020,영남지방 목관묘 출토 전기와질토기 편년- 원사고고학의 기초연구 -,"이 글은 원사고고학의 기초연구 일환으로 원삼국시대 영남지방 목관묘 출토 전기와질토기의 지역별 편년을 정리하고 그 과정에서 보이는 특징을 관찰하였다. 검토대상은 경주, 울산, 포항, 경산, 대구, 부산·김해, 창원, 함안지역에서 확인된 총 46개 유적이다. 그 결과 현재자료에 의하면 목관묘 유적의 수는 경주와 울산지역이 중심으로 두 곳 모두 Ⅰ-1기의 기원전 1세기 전엽에 출현하여 기원후 2세기 중엽까지 확인된다. 대구와 김해지역도 경주와 같이 Ⅰ-1기의 기원전 1세기 전엽에 출현하여 기원후 2세기 중엽까지 확인된다. 반면에 경주와 인접한 경산지역은 Ⅰ-2기의 기원전 1세기 중엽에, 포항지역은 Ⅰ-3기의 기원전 1세기 후엽에 출현하여 경주와 울산, 대구지역에 비해 좀 늦은 편이다. 또 부산과 함안지역은 Ⅰ-1기의 기원전 1세기 전엽에 출현하지만 단편적으로 확인되어 진한지역과 대조적이다. 다만 창원지역은 Ⅰ-1기의 기원전 1세기 전엽에 출현하여 기원후 2세기 중엽까지 확인된다. 전기와질토기의 큰 흐름을 정리하고 각 지역별 관찰을 통해 보면 기형의 흐름은 전체적으로 동일하지만 그 과정에서지역에 따라 특징적인 형태가 있거나 세부적인 차이를 보인다. 대표적으로 김해지역의 조합우각형파수부호는 동체부가 길고 경부는 낮아 다른 지역에서 흔히 보이지 않는 특징을 지녔다. 결국 경북지역 전기와질토기에서 확인된 전체적인 변화에서 관찰되는 공통점은 지역별 정보망이나 공통된 범형의존재를 시사하지만 세부적인 차이는 소지역 단위로 어느 정도 독립적일 가능성이 있는데 경남지역도 같은 맥락이다.",,,
187,한강유역 고구려 보루의 조사 성과와 연구 쟁점,양시은,중부고고학회,고고학,2020,한강유역 고구려 보루의 조사 성과와 연구 쟁점,"한강유역은 고대 삼국이 각축을 벌인 곳으로, 고구려 유적 역시 다수 분포하고 있다. 한강북안의 아차산과 그 인근(수락산, 배봉산, 봉화산)에는 정상부에 보루가 축조되어 있는데, 상당수는 고구려의 것이다. 본 논문에서는 한강유역 고구려 보루에 대한 그간의 조사 성과와 연구 쟁점, 그리고 앞으로의 활용 방안에 대해 살펴보았다. 1997년에 아차산 4보루의 조사를 시작으로 고구려 보루에 대한 지속적인 발굴과 이에 대한 집중적인 연구가 진행된 바, 비교적 짧은 기간 동안 많은 성과를 거두었다. 그러나 세부적으로는 연구자간 합의에 도달하지 못한 부분도 적지 않다. 연구 쟁점별로 주요 사안을 검토할 필요가 있다. 현재의 석축성벽 외 목책과 토성의 존재 여부와 같은 보루의 구조적 문제, 보루가 단순히 군사적인 목적에 따라 축조된 것인지 아니면 행정관청을 홍련봉 1보루에 두고 한강유역을 지배하였던 것인지와 같은 보루의 성격과 지배방식 문제, 그리고 아차산 보루군이 551년 백제와 신라의 한강유역 진출에 따라 폐기된 것인지 아니면 그 이후에도 고구려에 의해 재이용되었던 것인지에 대한 편년의 문제를 중점적으로 살폈다. 아차산 보루군에 대한 발굴조사를 시작으로 본격화된 고구려에 대한 관심은 국내 고구려 고고학의 기틀을 마련할 수 있는 중요한 출발점이 되었다. 한강유역의 고구려 보루와 출토 유물 연구는 역사적인 정황상 5세기 후반에서 6세기라는 확정된 시간 폭을 가지고 있어 고구려 고고학 연구에서 일종의 기준이 될 수 있다는 점에서 의미가 크다. 이제는 학문적인 깊이를 더하는 것 외에도 그간의 성과를 어떻게 활용하고 대중적으로 홍보할 것인가에 대해서도 고민이 필요한 시점이다.",,,
188,몽촌토성 북문지 일원 삼국시대 문화층의 최신 조사 성과,이혁희,중부고고학회,고고학,2020,몽촌토성 북문지 일원 삼국시대 문화층의 최신 조사 성과,"한성백제박물관은 개관 이듬해인 2013년 11월부터 서울 몽촌토성(사적 제297호)에 대한 연차발굴조사를 진행하고 있다. 그 대상은 1980년대 조사에서 소수의 Pit조사 이외에는 미조사구역이나 다름없었던 북문지 일원에 해당한다. 본고에서는 몽촌토성 북문지 일원 발굴조사의 최신 조사 성과를 소개하고 그 의미를 조명하였다. 몽촌토성 조사 성과에서 가장 주목도가 높은 삼국시대 문화층은 상층의 고구려 생활면과 하층의 백제 생활면으로 구분할 수 있다. 양 층에서는 복합적인 유구 양상이 확인되었으며, 이에 대해 구획식 포장도로, 대형 목곽집수지, 생활유구 집중구역으로 구분하여 살펴보았다. 구획식 포장도로는 백제 초축도로 단계, 백제 개축도로 단계, 고구려 도로 단계로 나눌 수 있다. 백제 초축도로는 Pit조사를 통해 1개의 도로가 확인된 상태이다. 초축도로 폐기 이후 조성된 백제 개축도로 단계에는 ‘回’자형교차로를 중심으로 여러 방향으로 분기해 나가는 남북대로, 회곽도, 북서향도로, 동서도로가 조성되었다. 도로는 격자상이며 도로에 의해 구획된 공간은 집수지로 추정되는 대형 유구와 생활유구 집중구역으로 구분된다. 각 유구는 도로와 중복되지 않은 정형성을 띠고 있으므로 사전에 설계된 도시계획에 의한 것임을 알 수 있다. 고구려 도로는 475년 백제 한성 함락 이후에 조성되었다. 기존 백제 개축도로의 선형을 거의 그대로 유지한 채 보수되거나 증축된 모습이다. 목곽집수지는 ‘回’자형교차로 내측에 위치하며 규모는 14×14m에 달한다. 벽체는 백제 개축도로 단계의 ‘回’자형교차로 내측으로 판을 대고 성토다짐하였으며 벽체 내부에서는 고구려 토기가 출토되었다. 목곽집수지에 대한 내부조사 과정에서 백제토기, 고구려토기, 건축부재, 각종 유구물이 다수 출토되었다. 목곽집수지는 일정 기간 활용된 뒤 인위적으로 폐기되었으며, 그 상부에 성토대지 조성공사가 이루어짐으로써 광장으로 변화한다. 목곽집수지의 조성과 폐기, 그리고 광장으로 변화 모두 고구려 점유기에 이루어진 것으로 판단된다. 생활유구 집중구역은 ‘回’자형교차로 북서부-회곽도-북서향도로가 감싸는 공간에 해당한다. 생활유구 집중구역은 백제 생활면과 고구려 생활면이 뚜렷하게 구분되고 있다. 이 공간은 성토대지 공사가 선행된 뒤 이를 굴착하며 주거지, 벽주건물지, 굴립주건물지, 초석건물지, 주혈군, 수혈 등이 조성되었음을 확인하였다. 몽촌토성 북문지 일원 삼국시대 문화층의 최신 조사성과를 통해 백제 한성기의 왕성으로서 개발하기 위해 도로와 각종 시설을 조성하였음을 알 수 있다. 그리고 475년 한성 함락 이후 고구려에 의해 남방경략거점으로서 몽촌토성이 개발된 고고학적 증거의 확보라는 점에서 그 의미를 조명하였다. 몽촌토성 북문지 일원 발굴조사에서는 다종다양한 유물이 출토되었다. 이를 통해 백제 한성기의 문화 및 주변국과의 교류, 한성 함락 이후 고구려 점유기의 양상, 당시의 고환경 및 식생을 파악할 수 있게 한다. 특히 소수이지만 백제 사비기 토기의 출토는 551∼553년 간 백제가 한성지역을 회복하였던 역사적 사실을 증명하는 자료로서 그 가치를 평가할 수 있다",,,
189,부여 송국리 유적 성격 재고,김경택,중부고고학회,고고학,2020,부여 송국리 유적 성격 재고,"청동기시대 중기가 되면 복합사회로의 진입을 시사하는 다양한 징후들이 확인된다. 부여 송국리유적을 중심으로 주변 마을들이 위계적 관계망을 형성하며 긴밀하게 연결되어 있었고, 송국리는 위계망의 최정상에 있는 복합사회의 중심이었다. 그런데 최근 청동기시대 전ㆍ중기의 잉여 산물의 저장 양상 변화, 특히 저장 전문마을의 등장과 관련하여 첨예한 논쟁이 있었으며, 논쟁의 핵심에는 부여 송국리유적이 있었다. 주거지 외부에 설치된 저장수혈을 근거로 잉여 산물이 생산자 개개인의 사적 소유물에서 공공재로 전환되었다는 주장을 펼친 「송국리단계 저장시설의 사회경제적 의미」 측에서는 저장 전문시설의 존재를 상정하고 이를 권력과 사회적 위계 형성의 근거로 인식했다.「호서지역 청동기시대 가구 변화의 사회경제적 의미」측에서는 ‘사회경제적 의미’ 에서 제시한 수치와 주거지 자료에 몇 가지 의문을 제기했고, 이에 대한 대응 및 반론이 있었다. 이에 대한 필자의 검토 결과, ‘사회경제적 의미’는 분석 결과에 앞서 원자료 처리에서 연구 결과의 신뢰도에 손상을 줄 수 있는 몇 가지 오류를 범했음을 밝혔다. 나아가 최근 조사성과를 기반으로 생산 및 소비 행위가 청동기시대 중기 송국리유적에서 활발하게 이루어졌음을 시사했으며, 잉여의 저장 또한 예외 항목으로 간주할 수 없으므로 송국리유적이 소비전문취락이라는 규정은 적절하지 않음을 밝혔다. 결론적으로 필자는 2008년 이후 송국리유적 발굴조사의 성과를 바탕으로 생산과 소비, 그리고 이에 따른 저장행위가 활발하게 이루어졌음을 강조했다.",,,
190,『한국 금속문명사: 주먹도끼에서 금관까지』 서평,조대연,중부고고학회,고고학,2020,『한국 금속문명사: 주먹도끼에서 금관까지』 서평,,,,
191,高靈 池山洞古墳群 內 追加葬의 含意,최정범,영남고고학회,영남고고학,2020,고령 지산동고분군 내 추가장의 함의,"경상북도 고령군 대가야읍에 위치한 지산동고분군은 주산의 주능선과 그 일대에 수많은 봉토분과 수혈식석곽ㆍ석 실묘가 조성된 대가야 최대의 고분군이다. 이에서는 대가야 멸망 이후에도 고분이 조성되는데, 기존의 수혈식석곽을 복토하거나 증ㆍ개축한 후 추가장이 이루어진 사례도 확인되며 그 시기는 6세기 후반대로 한정된다. 이러한 사례는 고고학적 현상 자체만을 놓고 본다면 수혈식에서 횡혈(구)식 묘제로의 변화와 장제의 변화를 뚜렷하 게 보여주고 있으며, 추가장의 대상은 어떠한 형태로든 먼저 매장된 피장자와 관련된 재지세력으로 볼 수 있다. 이를 지산동고분군 전체로 볼 때 신라의 대가야 정복 이후 묘제와 토기의 양식적 선택압이 작용하는 것에 더하여 역심엽형 대장식구와 당식 대장식구를 매개로 한 신라의 고령지역 통치가 확실하게 관철되었음을 극적으로 보여주는 사례라는 점에서도 그 의미가 결코 작지 않다.",,,
192,반구대 암각화의 제작실험 및 중복양상을 통한 제작연대 검토,박준철,영남고고학회,영남고고학,2020,반구대 암각화의 제작실험 및 중복양상을 통한 제작연대 검토,"반구대 암각화의 중복그림을 통해서 암각화 제작 개시 연대를 추정해보고 제작 실험을 통해 반구대 암각화의 다양한 기법(쪼기, 긋기 등)의 제작 시기에 따른 기술적 차이와 제작순서를 복원하고자 하였다 반구대 암각화의 제작연대를 고고학적 접근을 통하여 중복그림 중 가장 아래는 고래 그림임을 알 수 있엇다. 그리고 고래가 식(食)자원으로 이용되는 시작하는 시기는 융기문토기 단계(조기)로 융기문토기 집단이 암각화의 고래 그림을 제작하기 시작하였을 가능성도 추정 할 수 있었다. 마지막으로 암각화 제작 실험을 통해 암각화 제작 순서를 복원 보았 다. 암각화 제작에는 정밀한 그림을 그리기 위한 밑그림 단계가 있었을 것으로 추정되며 이후에는 그리고자 하는 부위 에 따라 다른기법(쪼기, 긋기)으로 제작되었다. 암각화를 제작하는 기술은 재질의 특성상 석기를 만드는 기술과 유사하 며, 찰절과 같은 기법이 신석기시대의 석기에서 관찰되기 시작하는 만큼 반구대 암각화를 제작 가능한 기술이 신석기 시대에도 존재함을 알 수 있었다",,,
193,백제 한성기 몽촌토성일대의 지형복원 연구,"이홍종, 안형기",호서고고학회,호서고고학,2020,백제 한성기 몽촌토성일대의 지형복원 연구,"1970년대부터 도시개발이 본격화된 송파구 일대는 현재 예전 지형의 모습을 찾아보기 힘들 정도로 극심한 지형 변화가 이루어졌다. 따라서 과거 지형의 모습을 복원하고 백제 도성 지역과 주변 환경의 유기적인 관계를 살펴보기 위해서는 항공사진을 이용한 고지형분석을 실시하는 것이 바람직하다. 최근 고해상도 항공사진의 공개와 고지형분석 프로그램의 발달로 몽촌토성, 석촌동 일대에 대해 세밀한 분석을 할 수 있는 여건이 갖추어졌다. 이를 토대로 몽촌토성 주변에 대한 미지형분석 및 고분군 위치를 추정해보았으며, 과거 지형 및 변화 양상에 대해 관찰하였다. 분석 결과 몽촌토성 및 석촌동 일대 고지형의 전체적인 모습은 큰 차이를 보이지 않았으나 일부 지점의 경우 세부적인 측면에서 미세한 차이를 보였다. 몽촌토성은 과거와 현재 성벽 형태가 차이나는 것이 확인되었으며 주변에서는 대규모 구하도의 흔적이 관찰되었다. 내외부에서는 여러 갈래의 소규모 하도 흔적과 습도표식이 관찰되었는데 그 중 일부는 과거 조사되었던 추정 연못지와 위치가 일치한다. 석촌동 일대는 재분석 결과 기존 연구에서 확인되지 않았던 산록완사면, 자연제방, 미고지, 구하도가 새롭게 관찰되었다. 일부 고분군의 위치는 지형과 상이한 것이 확인되었기 때문에 GIS 지리보정을 이용하여 석촌동 고분군의 위치를 재조정하였다. 3D 지형복원 결과 도시개발로 인한 많은 지형변경이 이루어졌음을 알 수 있다. 따라서 서울시 일대에 대한 고지형의 분포범위, 유적과의 상관관계를 정확히 파악하기 위해서는 과거 항공사진을 이용한 고지형분석을 실시한 후 그 결과를 가지고 해당지역에 대한 고고학적 조사를 실시해야 할 것으로 판단된다.",,,
