,title,author,publisher,journal,date,translate_title,Abstract,,,
567,여요와 이른바 여관요 - 여요의 성격과 관련된 논의의 역정,,(사)한국문화유산협회,야외고고학,2018,여요와 이른바 여관요 - 여요의 성격과 관련된 논의의 역정,"汝窯는 중국의 대표적인 名窯이다. 적지 않은 사람들은 이 여요를 가리켜汝官窯로 칭한다. 여관요는 汝州에 위치한 官窯라는 의미일 것이다. 여요가 관요의성격을 띠고 있었다는 견해를 처음 제출한 사람은 Percival David이다. 그의 주장은1937년에 발표된 논문 “A Commentary on Ju Ware”에 담겨 있다. 그가 핵심적인근거 자료로 제시한 것은 “大觀元年”銘輪形火照였다. 그렇지만 그는 여요를 여관요로칭하지 않았다. 여관요라는 명칭을 만들어낸 사람은 小山富士夫였다. 당시 그는 이른바北方靑瓷를 여요자기로 인식하고 있었는데, Percival David의 논문을 접한 후 사실상자신의 견해가 틀렸음을 인정하였다. 그러나 그는 자신의 견해를 폐기하는 대신 Percival David가 여요자기로 지목한 자기에 여관요자기라는 명칭을 부여한 것이다. 그러나 그 후 “大觀元年”銘輪形火照가 위조품으로 밝혀짐으로써 사실상 “여관요”라는명칭은 그 존재 이유를 상실하였다고 할 수 있다. 이때부터 淸凉寺汝窯址가 발견될무렵까지 사용된 “여관요”라는 명칭은 사실상 形骸化한 것이라고 할 수 있다. 1986년에청량사여요지가 발견되면서 여요가 곧 北宋官窯라는 견해를 중심으로 官窯說이다시 부상하였지만, 그것이 “여관요”라는 명칭에 객관적 타당성을 부여해 주었다고보기는 힘들다. 많은 연구자들이 관요설에 반대하는 입장을 견지하고 있기 때문이다. “여관요”라는 명칭의 출현이 오히려 여요 연구상에 혼란을 야기했을 뿐이라는 것이 필자의기본적인 생각이다. 북송말기에 여요가 성립되고부터 줄곧 이 窯場의 명칭은 “여요”였다. 20세기에접어들어 석연치 않은 계기로 “여관요”라는 명칭이 출현한 이후 여요의 개념과 명칭을둘러싼 혼란이 시작되었다. 이제 객관적 타당성이 담보되지 않은 “여관요”라는 명칭을버리고, 아울러 여요에게 본래의 명칭, 즉 “여요”라는 명칭을 되돌려줄 필요가 있다고생각한다.",,,
568,러시아의 발굴 -연해주 철기시대 얀콥스키 문화의 바라바시 3유적을 중심으로-,김재윤,(사)한국문화유산협회,야외고고학,2018,러시아의 발굴 -연해주 철기시대 얀콥스키 문화의 바라바시 3유적을 중심으로-,"러시아에는 현재의 국가차원에서 관리되고 있는 『러시아 지표조사와 발굴조사매뉴얼』은 역사적 배경이 있다. 이 매뉴얼에는 지표조사와 발굴조사 방법, 발굴허가증에 대해서 비교적 자세하게 적고 있다. 러시아의 발굴목적은 학술발굴이다. 자신의 연구전공과 맞는 유적을 찾고 발굴하는 것이기 때문에 지표조사는 중요하다. 따라서 『러시아 지표조사와 발굴조사 매뉴얼』에서는 지표조사의 평면도, 사진, 시굴방법과 범위, 수중지표조사 등에 대해서 밝히고 있다. 지표조사 시에는 1×1m 범위로 유적에서 여러 개의 시굴을 할 수 있다. 발굴조사는 학술발굴 혹은, 긴급발굴이라도 학술연구가 목적이 되어야만 한다. 뿐만 아니라 발굴조사의 목적, 물리적 환경, 기준점 설치, 발굴시 사용할 수 있는 도구, 그리드 설치 등에 대해서 그 기준을 정하고 있다. 발굴허가증은 과거에는 4개로 나누어졌으나, 현재는 5개로 좀 더 세분화 되었으며, 연구자의 학력과 경력에 따라서 신청할 수 있다. 국가가 발굴매뉴얼까지 정해서 두는 것은 넓은 영토를 국가에서 관리하기 위한 장치라고 볼 수 있다. 러시아 연해주의 바라바시-3유적도 『러시아 지표조사와 발굴조사 매뉴얼』에 따라서 발굴되었다. 2호가 가장 처음으로 발굴되었는데, 폐기된 주거지를 철기제작소로 이용한 것으로 판단된다. 육안으로 드러나는 수혈 위에 1m 간격 그리드를 치고, 십자둑을 남기고 10㎝ 미만으로 분층 별로 발굴하였다. 그 결과 6분층을 제거하고 나서야 정확한 어깨선이 드러났고, 내부 조사를 할 수 있었다. 내부토를 걷어내자 수혈의 동남쪽에서 검은 나무라인이 나타났고, 불 맞은 소토가 넓게 확인되었다. 아궁이 시설을 확인하였으며, 바닥에서 철부를 비롯한 철제품 8개가 출토되었다. 아궁이와 목탄라인을 완벽하게 제거하자 수혈 내부의 2중 라인이 드러났다. 십자둑은 가장 마지막에 실측과 토층도 작성 후에 제거하였다.",,,
569,김정기의 선사시대 수혈주거 연구와 쟁점,이형원,숭실사학회,숭실사학,2018,김정기의 선사시대 수혈주거 연구와 쟁점,"창산 김정기(1930∼2015)는 한국 고고학의 여러 분야에서 탁월한 업적을 낸 인물이며, 특히 선사시대 수혈주거 연구의 학문적 기초를 세운 연구자이다. 그의 대표 논문으로는 1968년도에 『고고학』 제1집에 실린 「한국 수혈주거지고(一)」와 1974년도에 『고고학』 제3집에 실린 「한국수혈주거지고(二」)를 들 수 있다. 이 두 편의 논문은 각각 신석기시대와 청동기시대 수혈주거 연구의 효시로 평가되고 있다. 그는 1980년대와 1990년대에도 수혈주거와 관련한 다수의 연구 논문을 집필하였다. 김정기는 선사시대 수혈주거와 관련하여 가옥의 위치를 비롯해서 평면형태, 규모, 바닥의 처리방식, 내부 시설물, 주거면적에 따른 거주 인원의 수, 가옥의 폐기 등을 연구하였다. 그리고 주거지 발굴과 관련하여 발굴 방법상의 문제, 고고학 자료의 해석상의 문제, 기록상의 문제도 다루었다. 김정기의 수혈주거 연구 가운데에서 가옥 내부의 공간분할과 관련한 칸막이 시설의 존재 유무를 비롯해서 송국리식(휴암리식)주거의 화덕 시설 여부, 수혈주거의 규모와 거주인원의 수 추정 등은 현재도 학계의 쟁점 사항에 해당한다. 김정기의 선사시대 수혈주거 연구는 발굴조사와 학술적 측면에서 학사적으로 중요한 의미를 가지고 있으며 한국고고학의 발전에 긍정적인 영향을 주고 있는 것은 확실하다. 한편 그의 논문들에 대한 평가에서 부정적인 측면은 편년에 대한 검토가 부족했다는 사실이다. 이것은 고고학 연구가 시간과 공간, 그리고 형태에 대한 정교한 조합을 토대로 이루어진다는 점에서 볼 때, 그의 학문적 유산에서 다소 아쉬움이 남는 부분이다.",,,
570,유적탐색을 위한 드론과 항공사진의 활용방안 연구,"허의행, 이왈영",국립문화재연구소,문화재,2018,유적탐색을 위한 드론과 항공사진의 활용방안 연구,"현재 국내 및 국외를 아울러 무인항공기(Unmanned Aerial Vehicle, UAV)의 관심이 상당히 높아졌다. UAV에는 영상을 촬영하는 카메라가 탑재되어 있어 고고학 조사가 불가능한 지역의 접근에 유리하다. 더구나 항공사진 촬영을 통해 지형을 모델링하여 3차원 공간영상정보를 취득할 수 있어, 조사 대상지역의 지형에 대한 해석을 구체화할 수 있다. 이와 함께 과거 항공사진과의 비교 검토를 통해 지형의 변화모습을 파악한다면 유적의 존재 여부의 파악에도 많은 도움이 될 것이다. 이러한 유적 탐색을 위한 지형모델링은 크게 두 부분으로 나누어 접근할 수 있다. 우선 드론을 이용한 현재 지형의 항공사진을 취득한 후 이를 영상정합하고 후처리 과정을 진행하여 완성하는 방법과 과거 항공사진을 이용한 영상접합과 지형모델링을 완성하는 방법 등이다. 이 과정을 거쳐 완성한 모델링 지형은 여러 분석결과를 도출할 수 있는데, 현재의 지형모델링에서는 DSM과 DTM, 고도분석 등의 지형분석을 실시하여 형질변경 및 미지형의 모습을 대략적으로 파악할 수 있고, 과거 항공사진의 지형모델링에서는 원지형과 저습지 내 매몰미지형의 모습 등을 파악할 수 있다. 이를 실제 조사된 내용과 비교하고 각각의 지형모델링 자료를 중첩하여 살펴보게 되면 구릉지형에서는 형질변경의 모습을, 저습지형에서는 매몰된 미지형의 모습을 볼 수 있어 유적의 존부를 파악하는데 매우 유용하게 사용될 수 있다. 이처럼 항공사진을 이용한 모델링 자료는 고고학현장에서 조사가 불가한 사유지나 광범위한 지역의 지형에 유적의 존재여부를 파악하는데 유용하며, 추후 유적의 보존처리와 관련한 논의에도 적극 이용될 수 있다. 나아가 과거와 현재의 지형자료의 비교를 통해 지적도나 토지활용도 등의 주제도로 제공이 가능하는 등, 다양한 방식으로의 활용 가능성을 생각할 수 있다. 그러나 무엇보다도 고고학 자료의 존재유무 파악을 위한 유적 탐색의 새로운 조사방법론으로 기능할 수 있다.",,,
571,북한지역 신석기시대 집자리 유적의 발굴보고와 연구성과,구자진,한국신석기학회,한국신석기연구,2018,북한지역 신석기시대 집자리 유적의 발굴보고와 연구성과,"우리나라 신석기시대 집자리 연구는 1950년 북한에서 발굴 조사된 궁산 유적이 그 시발점이된 이래 70년 가까운 역사를 지닌다. 신석기시대 집자리 연구는 초기에 북한에서는 집의 상부구조복원에 초점이 맞추어져 있었으며, 남한에서는 시기에 따른 집자리 구조나 입지, 마을의 배치 등이 검토되었다. 본고에서는 북한에서 보고된 신석기시대 집자리 유적의 발굴조사 보고를 분석해발굴조사와 결과보고에서 들어나는 특징과 변화양상을 검토해보고자 한다. 검토 결과, 시기에 따른 발굴보고문의 체계 혹은 내용의 질과 양적인 면에서 많은 변화가 있음을 확인하였다. 이는 신석기시대 집자리 유적에 국한된 것이 아닌 북한 고고학 연구의 전반에 걸쳐 일어난 현상으로 판단된다. 북한에서의 신석기시대 집자리 유적에 대한 발굴보고문은 1970년대 중반 이후, 신석기시대 집자리 유적의 발굴조사가 급격히 감소함과 동시에 이전 시기의 「유적발굴보고」, 「고고민속론문집」, 「고고학자료집」 등이 사라지면서 1986년 창간한 「조선고고연구」 에 발굴보고가 이루어지면서 급격히 쇠퇴해 가는 양상을 보인다. 우리나라 신석기시대 연구는 초기에 북한지역에서 이루어진 궁산, 지탑리, 금탄리, 서포항 유적등의 발굴조사 및 연구성과를 토대로 그 뼈대를 잡았다고 해도 무방하다. 그러나 1970년대 중반이후부터는 북한지역 신석기시대 유적의 발굴보고문에 대한 불확실성으로 인해 더 이상 북한지역의 신석기시대 유적을 통한 연구의 진전이 이루어지지 않고 있어 더욱 아쉬움으로 남는다.",,,
572,몽골의 옛사람 뼈 : 한국·몽골 국제공동연구 분석보고서. 2,신지영 조은민 Bat-Erdene 윤은영 Ts. Amg,국립중앙도서관,국립중앙도서관 연계자료,2018,몽골의 옛사람 뼈 : 한국·몽골 국제공동연구 분석보고서. 2,,,,
573,탄화물 분석을 통한 삼국시대 대두 이용 방법 고찰,"김민구, 류아라",한국상고사학회,한국상고사학보,2018,탄화물 분석을 통한 삼국시대 대두 이용 방법 고찰,"호남과 강원 지역에 소재한 삼국시대 주거지에서 덩어리 형태로 탄화된 대두(大豆) 잔존물을 발견하였다. 일련의 탄화 실험과 현미경 검경을 통해 다음 결론을 내릴 수 있었다. 첫째, 탄화물은 주로 콩으로 구성되어 있으며 다른 작물의 흔적은 확인되지 않는다. 둘째, 탄화는 콩이 덩어리 형태로 빚어진 다음에 발생한 것이다. 즉, 탄화 과정에서 덩어리가 생성된 것은 아니다. 셋째, 탄화물 단면에서 다공(多孔) 구조가 확인되는데 이는 대상물이 탄화되기 이전에 약간의 수분을 지닌 반죽 형태로 존재했을 가능성을 나타낸다. 관찰된 탄화물들은 주거지 바닥면에서 수습된 것이며, 주거지 내부에 저장되었던 음식 또는 음식의 재료로 생각된다. 분석 결과를 종합했을 때, 확인된 대두 탄화물은 메주 같은 두류 발효 식재료의 잔존물일 것으로 판단된다. 메주 또는 된장과 관련한 가장 오래된 국내 역사 기록은 683년 신문왕대의 것이다. 고고학 자료상으로 메주 잔존물은 AD 3세기 이후 유적에서 빈번하게 발견된다.",,,
574,山東 岳石文化의 최근 연구동향과 쟁점-우리 상고문화의 영역에서 작용되는 몇 가지 문제에 관하여-,오대양,한국상고사학회,한국상고사학보,2018,산동 악석문화의 최근 연구동향과 쟁점-우리 상고문화의 영역에서 작용되는 몇 가지 문제에 관하여-,"현재 대다수의 중국연구자들은 龍山-岳石文化로 연결되는 山東地域 신석기~초기 청동기시대유적을 동이문화로 파악하는 경향이 있다. 하지만 당시에 과연 사회·정치·문화적으로 단일한 종족적개념으로서의 동이관념이 존재하였을 지에 대한 의문이 강하게 제기된다. 동이의 정체성이 山東 또는黃河 하류유역 집단들 사이에서 형성·발전되었다면 동이라는 완전한 단어가 명문에 처음 나타나는西周시기, 이를테면 岳石文化의 붕괴 후 적어도 4세기 가량이 지나서야 출현했다고 보는 것이 합리적일 듯하다. 다음으로 중국 동북지역의 동이(동북고민족의 범칭)와 山東地域의 동이를 동일시하는 거대 동이담론의 이면에는 다음과 같은 의도가 간파된다. 고대 중국의 동쪽지역에는 중원의 華夏族과 경쟁하였던별개의 종족집단이 존재하였다. 이들은 龍山文化단계에 黑陶文化라는 독특하고 고유한 토기문화를발전시켰는데, 이를 당시 중원지역과의 지속적인 교류상 속에서 완성된 고대 중국문화의 정수로 평가한다. 수십 년에 걸친 연구 끝에 이 문화의 주체자들은 문헌 속에 표현된 동이집단으로 설정되었고, 이들은 大汶口-龍山-岳石文化로 연결되는 山東地域 선사문화의 계보 속에서 끊임없이 중원지역과 의 경쟁구도를 구축, 중국 고대국가의 발전기인 商周시기를 거쳐 華夏族에 완전히 통합되면서 현대 漢族의 주요 구성원이 되었다. 그러한 과정 중, 商末周初 동이족의 한 갈래(기자집단)이 중국 동북지역으로 이주하여 고조선문화를 개화시켰고, 그러한 배경 하에 山東의동이족과 동북동이는 동일한 계보와 문화전통을 가진 하나의 역사·문화·민족공동체로 거듭나게 된다. 결론적으로 중국 동북지역에서 발원한 모든 고대 민족들을 전설 속 黃帝族의후예로 삼는 소위 ‘遼河文明論’과 이지역 고대 민족들이 이룬 모든 역사를 중국의 역사로 편입시키고자 하는 ‘東北工程’의 허울아래 우리의 상고문화는 고대 중국문명의 방계문화로 전락하게 되는 것이다. 우리가 주변국가의 역사왜곡에 직면하여 하나의 공감대를 형성할 수 있는 부분이 바로그것이 명백히 잘못되었음을 충분히 인지하고 있는 점이다. 문헌기록이 매우 제한적인 상황에서 주변국가의 역사왜곡에 적절히 대응하기 위해서는 현지의 고고학 조사자료를 충분히 활용해야만 한다. 비굴할 필요도 없지만 자극할 필요는 더더욱 없다. 보다 전략적인 접근방식이 필요한 시점이다. 우리 내부에서 형성된 공감대로써, 주변국가의 역사왜곡에 일침을 가할 수 있는 자료의 확보가 우선시된다.",,,
575,발해 강역 연구의 현황과 전망,윤재운,백산학회,백산학보,2018,발해 강역 연구의 현황과 전망,"발해의 강역은 건국부터 멸망까지 정치 전개과정과 밀접한 관련을 가진다. 이러한 발해사의 정치사적 시기구분에 대한 의견은 커다란 차이는 없다. 그리고 그 주요한 분기점은 제3대 文王 시기까지와 제10대 宣王 즉위시점부터라는 점에서 모두가 일치하고 있다. 즉 문왕 이전이 건국ㆍ발전기라고 할 것 같으면, 선왕 이후에 중흥기를 맞이하였다고 할 수 있다. 발해는 고구려의 옛 영토를 대부분 차지하고, 거기에 동북쪽으로 그 강역을 확대하였다. 발해의 강역은 제10대 宣王 및 제13대 大玄錫代에 가장 넓었다고 하는데, 사방 5천리에 이르렀다고 한다. 대체로 보아 발해의 영역은 남쪽이 신라와 국경을 접하고 있었고, 서쪽은 遼陽의 遼東에 미치고 있었다고 보인다. 북쪽은 대체로 흑룡강과 우수리강이 합류하는 지점을 거쳐 동쪽으로 연해주에 뻗쳐 있었을 것으로 볼 수 있다. 이러한 발해의 강역에 대해서는 여러 異見이 존재하고 있는데, 특히 西邊과 東北境이 그러하다. 西邊의 경우는 요동의 귀속여부와 그 시기 문제, 東北境은 연해주지역의 말갈과의 경계 등이 주요 쟁점이다. 남쪽의 신라와의 경계도 다소의 이견이 존재한다. 우선 발해의 서변에 대한 제논의는 발해가 요동지역 점유를 어떻게 보느냐에 의해 요동점유설과 요동완충설로 크게 나누어 볼 수 있다. 발해의 서변에 대한 실체 규명을 위해서는 돌궐-당의 동향이나 당-거란의 동향도 고려하면서 이 전투의 배경을 다시 검토할 필요가 있을 것이다. 다음으로 발해의 남변에 대해서는 『신당서』를 근거로 泥河를 경계로 신라와 접하고 있다고 보는 것이 일반적이나, 요동완충설에서는 757년 안동도호부 폐지 이후, 발해도 서쪽으로 진출하지 않고 신라도 대동강 이북으로 진출하지 않았기 때문에 요동 지역은 방치되어 있었다고 한다. 따라서 발해와 신라는 서쪽에서는 경계를 접하지 않았다고 한다. 마지막으로 발해의 북변과 동변은 연해주지역의 말갈유적을 어떻게 해석하느냐에 따라 견해의 차이가 있다고 할 수 있다. 결국 발해 강역 연구의 활성화를 위해서는 서변은 사료 검토를 통한 돌궐ㆍ거란과의 관계가, 북변과 동변은 말갈유적의 고고학 성과의 수집과 해석이 관건임을 알 수가 있었다.",,,
576,夏家店下層文化 城子山산성의 성격과 기능-GIS를 활용한 유적·유구의 공간분포 분석을 중심으로-,"강승우, 양홍진",한국고대학회,선사와 고대,2018,하가점하층문화 성자산산성의 성격과 기능-GIS를 활용한 유적·유구의 공간분포 분석을 중심으로-,"중국 네이멍구 아오한치에 위치한 청쯔산 산성은 샤쟈띠엔샤층문화의 대표 유적 중 하나로 2000년 중국 중요 고고학 발견으로 지정되면서 세간의 관심을 끌었다. 특히 대규모의 면적, 내성과 돼지머리 모양으로 다듬은 석상의 존재, 청쯔산 남쪽에 위치한 야지산과의 지리적 연관성 등 다른 유적들과 구별되는 독특한 특징들로 인해 샤쟈띠엔샤층문화를 대표하는 주요 유적으로 손꼽히고 있다. 그러나 아직 발굴조사가 시행되지 않아서 유적의 정확한 기능과 성격이 밝혀지지 않았으며, 주거지·방호용 요새·제사 혹은 천문관측 시설 등 다양한 견해가 제기되고 있다. 본 연구에서는 먼저 시랴오허 유역에 광범위하게 분포하는 샤쟈띠엔문화 유적들의 지리적 분포를 분석하여, 청쯔산 산성이 문화권의 중심지에서 벗어난 곳에 위치하여 특별한 용도에 따라 조성된 유적임을 확인하였다. 그 다음 청쯔산 산성을 포괄하는 경관으로 범위를 좁혀 유적 내 유구들이 주변 자연환경 및 지형지물과 어떠한 관련성을 가지는지에 대해 분석을 진행하였다. 보다 상세하고 자세한 연구를 위해 기왕의 지표조사와 고고천문 연구 성과를 기초 위에 지리정보시스템(GIS) 분석을 시행하였고, 그 결과 청쯔산 산성이 많은 사람이 상시 주둔해야 하는 군대나 거주지 유적으로는 적합하지 않다는 결론을 내렸다. 또 유구들의 성격과 배치구조 분석을 통해 유적이 진남북 방향을 활용하여 조성되었음을 확인하였고, 이는 체계적인 천문관측을 통해 천문방향에 따라 제단을 배치했을 가능성이 있음을 의미한다. 이를 통해 청쯔산 산성의 성격이 학계에 제기된 주거지·방호용 요새·제사·천문관측 시설 중 어떠한 견해에 근접하는지 추론을 할 수 있었고, 그 결과 청쯔산 산성은 천문관측을 통해 주변 지형을 적극적으로 활용하여 계획적으로 만들어졌으며, 광역 단위의 제사 및 제천의식을 거행하는 장소였음을 추측해볼 수 있다.",,,
577,"초기 고조선 네트워크의 형성과 비파형동검문화 —기술, 무기, 제사를 중심으로",강인욱,한국고고학회,한국고고학보,2018,"초기 고조선 네트워크의 형성과 비파형동검문화 —기술, 무기, 제사를 중심으로","고조선에 대한 체계적인 접근을 위해서는 유라시아적 보편성과 한반도~만주의 지리적 특성에 근거한 고고학적 모델이 필요하다. 본고에서는 기존 문헌사의 연구에 경도되었던 고조선에 대한 연구를 고고학적으로 활성화시키기 위하여 청동제련기술, 무기의 발달, 의례의 형성이라는 세 가지 예를 통하여 고조선의 성립과정을 고찰했다. 초기 고조선의 청동기는 이러한 발해만~한반도에 이르는 청동기문화에기반하여 하가점상층문화의 영향을 받아서 발해만유역에서 형성되었다. 십이대영자유적 단계에는 그이북의 하가점상층문화가 약화됨에 따라, 무기 대신에 다뉴경과 다양한 의기의 제작으로 위신재를 만들고 지역 간 네트워크를 형성했다. 비교적 넓은 지역에 이루어진 이러한 네트워크는 청동기의 생산 및 이데올로기의 공유로 강하게 유지되었다. 다뉴경이라고 하는 고도의 기술이 필요한 의기를 사용하고재분배함으로써 이 네트워크를 유지했다. 기원전 7~4세기 중국의 선진기록에 기록된 고조선에 해당하는 집단은 요서지역-요동반도-한반도로 이어지는 연안의 [비파형동검+다뉴경]의 네트워크에 해당된다. 이 네트워크는 지속적으로 중심지와 분포영역이 바뀌었고, 기원전 4세기를 전후해서 고조선과 그주변 집단은 영역화가 되는 변화를 거친다. 기원전 7세기에 고조선이 중국 기록에서 인식된 이유는 이러한 네트워크망의 증가에 따른 정보의 유입과 관련된다. 기원전 4세기경에 고조선은 네트워크 중심에서 영역화된 국가로 바뀌면서 그 성격이 급변했다. 요서지역은 다뉴경 네트워크에서 벗어나서 연국계통의 위신재를 도입했다. 요동지역 고조선은 상보촌 / 윤가촌유형으로 통합되었으며, 서황산둔유형은 부여로, 남성리유형은 마한의 전신으로 통합되는 등 각 지역은 영역화가 되어 독자적인 사회세력으로 성장한다. 이에 따라 발해만 연안의 네트워크가 붕괴되면서 고조선은 백두산 일대 및 송화강유역, 연해주 등 내륙으로의 루트를 강화한다. 이 시기 요북에서 길림지역으로 이어지는 교통로에서 발견되는 소위 ‘연 장성’의 증거는 실질적인 지배를 위한 장성이 아니라 중국의 정치 세력이 고조선과 경쟁하여 중국 동북지역 내류 일대와 교역을 하여 이득을 취하기 위한 거점으로 해석된다. 이러한 다뉴경 네트워크가 붕괴되고 고조선이 내륙지역과 관계가 강화되면서 한반도는 독자적으로 세형동검문화를 영위하게 되었고, 한반도 각지에 세형동검문화가 널리 확산되었다.",,,
