,title,author,publisher,journal,date,translate_title,Abstract,,,
380,웅치전적지 위치와 지정범위 재검토,"천선행, 박춘규, 심진수 외 2명",(사)한국문화유산협회,야외고고학,2019,웅치전적지 위치와 지정범위 재검토,"1976년 4월 2일 전라북도 기념물 제 25호로 지정된 웅치전적지의 지정범위는임진왜란 당시 웅치전투 실제 전투지와 일치하지 않는다. 1980년대 후반부터 문헌· 전승·지명 조사, 최근의 고고학적 성과로 미루어 볼 때, 웅치전투의 주 격전지는 덕봉길주변임이 밝혀지고 있다. 이에 따라 웅치전적지 지정범위에 대한 변경의 필요성이 커졌다. 다양한 견해를 검토하여, 본고에서는 웅치전투의 시·공간성을 재정립하고, 고고학적 성과를 바탕으로 웅치전투의 역사성과 웅치 ‘옛 길’의 의미를 투영하여, 웅치전적지가 점적공간이 아닌 선상으로 이루어진 공간으로 지정되어야 한다고 보았다. 구체적으로 웅치전투의 추이에 따라 신기마을〜두목마을 구간, 신기마을〜안덕원 일대 구간, 곰티재길을 포함한 구간의 3개 범주로 나누었다. 이 가운데, 신기마을에서 안덕원 일대에 이르는 구간, 곰티재길을 포함한 구간을 최종지정 목표로 삼고, 조사경과와 성과, 지정여건을 충분히 감안하여 지정범위를 순차적으로재조정하고 단계별로 확대해 나가야 한다고 보았다. 아울러 문화재 활용을 위해, 지정범위의 조정은 물론, 웅치전투와 전적지에 대한 심도 깊은 조사와 연구, 고증이 지속적으로 필요하고, 특히 덕봉길 주변으로 집중되어 있는 조사경향에서 탈피하여 안덕원에 이르는 지역까지 포괄한 전면적 조사가 동시에 진행되어야 한다. 지정범위 조정을 위한 학문적 뒷받침, 고고학적 실증, 그리고 도와 시군의 적극적 협력을 통해, 웅치전투의 역사성은 물론 임진왜란, 옛 길, 전라도를 아우르는 종합적 활용방안이 계획되고 구현되어야 할 것이다.",,,
381,삼국시대 수저의 보급과 식사방식,오승환,(사)한국문화유산협회,야외고고학,2019,삼국시대 수저의 보급과 식사방식,"오늘날 숟가락과 젓가락을 함께 사용하는 식사방식은 다른 나라에서 보기 어려운한국만의 고유한 음식문화이다. 그러나 우리나라에서 숟가락과 젓가락을 이용한 식사방식이 언제부터 시작되었으며, 초기의 사용방식은 어떠하였는지에 대해 아직 밝혀지지 않았다. 이 글은 우리나라에서 숟가락과 젓가락을 이용한 식사법의 등장과 사용방식, 나아가당시의 음식문화에 대해 살펴보고 있다. 한반도에서 가장 이른 시기의 숟가락은 낙랑의 분묘에서 출토되지만 일부 최상층 무덤에 한정되며 아직 젓가락은 보이지 않는다. 삼국시대에는 숟가락과 젓가락이 모두 나타나며, 다양한 재질과 형식이 생활유적에서 출토되는 것으로 보아 이때부터 본격적으로 사용되었음을 알 수 있다. 고구려는 숟가락과 젓가락이 4세기 말~5세기 초 오녀산성에서 출토되므로 늦어도 이 때부터 사용되었음을 알 수 있다. 신라에서는 숟가락이 금관총 출토품외에 사례가 없어 사용여부가 불분명하다. 다만 젓가락은 함안 성산산성에서 다수 출토되어 6세기 후반에는 사용되기 시작한 것으로 보인다. 백제의 한성~웅진기 사례는 많지 않으나 사비기부터 여러 유적에서 다양한 재질과 형식이 나타난다. 이는 숟가락과 젓가락을이용한 식사방식이 일찍부터 사용된 南北朝의 여러 나라와 활발히 교류하면서 그들의 음식문화를 받아들인 데서 그 배경을 찾을 수 있을 것이다. 그 결과, 숟가락과 젓가락을 이용한 식사방식이 점차 하급관료나 그 하위계층에도 확산되었을 것으로 판단된다. 따라서고구려와 신라에서는 주로 왕실과 귀족층 위주로 숟가락이나 젓가락이 사용되지만, 백제에서는 사비기부터 점차 그 사용 계층이 확대되었음을 알 수 있다. 숟가락과 젓가락을 이용한 식사예법이 시작된 곳은 고대 중국이지만 처음부터 숟가락과 젓가락이 함께 쓰였던 것은 아니다. 고대 중국에서 숟가락은 국물이나 죽을 뜨고, 젓가락은 국물 속의 건더기를 건지는 용도였으나, 점차 젓가락은 밥과 음식을 먹는데 사용되었다. 우리나라에서도 삼국시대에는 동시기의 중국과 마찬가지로 숟가락과 젓가락을 함께사용하지 않았다. 이러한 사실은 무령왕릉의 숟가락과 젓가락이 서로 다른 곳에 놓인 데다짝도 맞지 않는 데서 알 수 있다. 중국에서도 商~南北朝時代까지는 숟가락과 젓가락을한 벌로 쓰지 않았으며, 그 배치도 음식기의 측면에 세로방향으로 두었다. 唐代에 이르러숟가락과 젓가락은 지금의 우리나라와 마찬가지로 한 벌을 이루어 사용하기 시작하였다. 그리고, 밥상에서의 배치는 음식기 앞에 가로 방향으로 두었다. 고대 중국의 식사예법은교류가 활발하던 동시기 백제의 음식문화에도 영향을 미쳤을 것이다. 무령왕릉에서는 출토맥락이나 여러 정황으로 보아 아직 숟가락과 젓가락은 한벌로 사용되지 않았으며, 그 배치도 음식기 옆에 세로 방향으로 놓였을 가능성이 크다. 이러한 특징은 사비기까지 지속되는 것으로 보인다. 이상에서 보듯 숟가락과 젓가락은 고대 동아시아의 음식문화와 식사예법을 이해하는데 있어 주요한 機制가 될 수 있음을 잘 보여주고 있다",,,
382,기와 결손·보수로 본 지붕구조의 가설적 복원,노윤성,(사)한국문화유산협회,야외고고학,2019,기와 결손·보수로 본 지붕구조의 가설적 복원,"기와연구에서 기와의 수명과 교체주기에 대한 연구는 아직 부족한 듯하다. 이 문제에 대하여 민족지 조사방법을 이용하였다. 경주권역의 1950년 이전 제작된 막새가 남아있는 관아건물, 향교, 서원 등 건축물 7동에 대하여 막새 위치를 표시하고 조사하였다. 조사결과 건축물의 방위와 지붕의 형태에 따라서 막새 결손·잔존률이 다르게 나타났다. 남향 건축물 기준으로 지붕형태와 관계없이 우선 북쪽의 막새가 가장 빠른 주기로 교체되었다. 다음으로 동·서·남면의 처마부 막새가 교체되었으며, 합각부 교체주기가 가장 늦어서 오래된 막새가 잔존하는 양상을 보였다. 건축물에 사용된 막새 수명은 400년 이상 잔존한 경우도 있었으며, 한 건물에 20종 이상의 암·수막새가 올려진 경우도 있었다. 또 암막새의 보존율이 수막새에 비해 상대적으로 높았으며, 수막새의 결손률이 높아 건축물의 수명이 길수록 총 사용된 수막새의 양이많았음을 알 수 있었다. 또한, 합각부의 막새 잔존률이 높은 이유는 연암과 내림마루, 착고에 의해 보호되었고, 또 보수 시 교체하지 않는 경향이 있었다. 이에 반해 처마부 수막새는 직·간접적 동파에 의해 홍두깨흙이 유실되어 낙하로 인해 결손되는 사례가 많았다. 건축물에서 막새의 결손과 보수는 상시 일어나는 현상이자 행위이므로, 소규모 보수는상시 행해지고, 지붕 위치별 교체주기가 다르기 때문에 4면의 교체주기가 만날 때 대규모중수(重修)가 행해진다고 보았다. 따라서 결손과 보수의 측면에서 지붕 기와의 교체패턴을이해할 수 있다. 이상의 결과를 건물지 유적 발굴조사에 응용하면, 건축물의 방향과 막새의 분포양상에따라 건물의 지붕구조를 추정해 볼 수 있다. 여러 가지 전제조건과 예외적인 상황이 있지만, 남향한 건물 기준으로 동·서·남면에 오래된 막새가 집중되고, 북쪽에 가장 늦은 시기의 막새가 출토되면, 우진각지붕일 확률이 높다. 또 동·서면에 가장 오래된 막새가 출토되고, 남면에 중간시기의 막새, 북면에 가장 늦은 시기의 막새가 출토되면, 맞배지붕일확률이 높다. 또 동·서·남면에 같은 시기의 막새가 출토되고, 그 상부에서 가장 빠른 시기의 막새가 출토되며, 북면에서 가장 늦은 시기의 막새가 출토되면, 팔작지붕일 확률이높다고 보았다. 이상의 내용을 근거로 소비지인 건물지 유적 조사 시 막새 분포에 대한 기록문제, 그리고 막새를 편년하는데, 공반유물을 통한 하한연대 설정에 대한 재고가 필요해 보인다.",,,
383,고고유적에서 출토된 사람 뼈의 키 추정방법과 결과해석,"정양승, 우은진",(사)한국문화유산협회,야외고고학,2019,고고유적에서 출토된 사람 뼈의 키 추정방법과 결과해석,"사람의 키는 개인을 식별하는 과정에서 중요한 정보가 되고 과거 인구집단의 체질적 특성은 물론 집단이 속한 사회의 일반적인 복지 및 생활수준을 유추할 수 있게 한다. 이러한 맥락에서 생전의 키를 추정할 수 있는 방법들을 개발하고 이를 이용해 과거 집단의 키변화를 파악하고자 하는 시도가 활발히 이루어져 왔다. 이때 당시 사회의 성격이나 집단의체질적 특성을 왜곡없이 복원하기 위해서는 개체의 키가 가급적 실제 키에 가깝게 측정 또는 추정되어야 한다. 이 연구에서는 국내 고고유적 출토 사람 뼈를 대상으로 키를 추정하고자 할 때 빈번하게 사용되는 방법을 검토하고 향후 연구에서 키 추정 자료가 어떻게 제시되고 또 해석되는 것이 바람직한지에 대해 모색하고자 하였다. 먼저, 키 추정 방법 면에서 뼈대가 온전한 상태라면 수학적 공식보다는 해부학적 방법을사용하여 키를 추정하는 것이 바람직하다. 그러나 뼈대의 보존상태가 좋지 않아서 수학적방법을 사용해야 한다면 한국인 집단을 이용하여 만들어진 키 추정공식을 사용하기를 바란다. 또 키 추정공식을 선택할 때에는 고고유적에서 출토된 뼈대와 같은 마른 뼈를 바로 공식에 대입하여 사용할 수 있는지, 시신의 키가 아닌 생전의 최고 키를 추정할 수 있는지를정확히 살펴보아야 한다. 이외 공식에 이용된 뼈대를 계측하는 방법이 명확히 제시되어 있어 연구자가 제시된 방법을 그대로 재현할 수 있는지에 대해서도 고려할 필요가 있다. 공식을 실제로 적용할 때는 공식 개발에 이용된 자료 및 방법론에 대한 이해가 전제되어야 하며, 만약 연구자들이 공식을 사용할 때 특별히 권고하는 사항이 있다면 이를 바르게숙지하고 적용해야만 보다 정확하게 키를 추정할 수 있다. 마지막으로, 키 추정치를 보고할 때 가급적 키 추정에 사용된 뼈대의 종류와 계측치를 함께 제시하면 후속 연구자들이 새로운 방법을 적용하는 등 추가 연구를 진행하는데 큰 도움이 되리라 생각한다.",,,
384,제작 기술로 본 익산 왕궁리 사리장엄구 제작 시기 연구,박정현,(사)한국문화유산협회,야외고고학,2019,제작 기술로 본 익산 왕궁리 사리장엄구 제작 시기 연구,"이 글에서는 익산 왕궁리 5층석탑에서 출토된 사리장엄구 중 사리용기 제작 기술을 분석하여 제작 시기 및 제작지에 대해 살펴보았다. 이와 더불어 사리용기와 함께 출토된 유리기와 이외의 사리공양구의 구성을 신라·백제 사리장엄구와 비교하였다. Ⅱ장에서는 사리장엄구 연구의 전반적인 흐름을 살펴본 다음, 익산 왕궁리 사리장엄구제작 시기에 관한 기존의 연구사를 검토하였다. 기존 연구자들은 사리용기 표면에 시문된문양의 비교사적 검토와 <觀世音應驗記>를 근거로 제작 시기를 비정하였다. Ⅲ장에서는 사리용기 제작 기술 중 표면제작기법에서 확인되는 제작 기술적 속성을 검토하고 제작지가 밝혀진 신라·백제 사리용기와 비교하였다. 왕궁리 사리용기는 백제에서제작된 왕흥사, 미륵사 사리용기 제작 기술과 유사하다는 것을 알 수 있었고, 새로운 기법인 어자문 C형을 확인했다. Ⅳ장에서는 유리기와 그것을 안치한 대좌, 사리공양구의 구성을 신라·백제 사리장엄구와 비교하고, 왕궁리 유적의 기능변화의 측면에서 왕궁리 사리장엄구를 살펴보았다. 그 결과 신라 사리장엄구 방식을 공유하고 있었음을 확인할 수 있었다. 이를 통해 왕궁리 사리용기는 백제 사리용기 제작기술을 바탕으로 신라 사리장엄방식이전파된 7세기 후엽, 통일신라 대 제작되었음이 확인되었다",,,
385,경주 분황사 모전석탑 석재의 산지 연구,황창한,(사)한국문화유산협회,야외고고학,2019,경주 분황사 모전석탑 석재의 산지 연구,"경주 분황사 모전석탑에 사용된 석재는 안산암 재질에 해당하는데 경주 인근에서몇 곳의 후보지가 확인된다. 후보지를 답사한 결과 울산 당사동 일대에 분포하는 당사리안산암과 외형 및 암석의 구조적 특징이 동일한 것으로 파악되었다. 당사리안산암의 분포는울산 당사동 일대에 널리 분포하는데 산출상태가 석탑에 사용된 석재에서 보이는 판상의절리, 암자색 산화철 성분의 산화면 등이 동일하다. 특히 암자색으로 산화되는 절리면은후대에 풍화된 것이 아니고 절리면을 따라 산화된 것이다. 이러한 암석의 구조적인 특징은 산화된 면을 따라 절리되거나 채석을 하기에 용이하여 석탑의 재료로서 최적의 산출 상태를 보인다. 석재의 인식은 당사리안산암 산지 일대의 유적을 검토한 결과 강동지역에 거점을 두고 생활했던 삼국시대인들로 부터 알려졌을 것으로 추정하였고 이 지역의 불교문화와도 관련이 있을 가능성을 제시하였다. 현재로서는 정확한 채석지의 흔적을 확인할 수는없기 때문에 석재가 다량으로 확인되는 계곡부와 해안가의 석재를 채석하여 사용한 것으로 추정하였으나 당사리안산암이 분포하는 일대로 넓게 비정하는 것이 합리적이라고 판단된다.",,,
386,한반도 고대토기 생산기술의 복원 연구 - 태국 북부지역 민족지사례 비교연구를 통해 -,"김은정, 정다운, 조사라",(사)한국문화유산협회,야외고고학,2019,한반도 고대토기 생산기술의 복원 연구 - 태국 북부지역 민족지사례 비교연구를 통해 -,"이 글에서는 한반도 고대토기 생산기술체계 복원의 일환으로, 민족지사례에서 토기생산기술을 추출하고 그 적용 가능성을 검토하였다. 조사는 태국(Thailand) 북부에 위치한 반 므엉 꿍(Baan Muang Kung)과 반 꾸언(Baan Kuan) 마을에서 진행하였다. 이들 마을은 전통적으로 토기를 생산해 왔으며, 오늘날까지도 적색 안료를 바른 후 마연한 토기, 연을 입힌 흑색마연토기, 타날기술로 성형한 토기 등을 생산·공급하고 있다. 민족지사례를 통해서는 1) 원료의 조달과 태토의 제작 기술, 2) 타날과 기면의 조정, 3) 채색 및 마연, 4) 소성의 방법과 흑반의 생성과정, 5) 탄소 흡착 기술(연 입히기) 등의 토기생산 기술을 추출해 낼 수 있었다. 이와 같은 기술은 한반도의 고대토기 생산기술을 복원하는 데에 적극 활용하고 비교해볼 필요가 있다. 특히 한반도의 청동기∼삼국시대 토기중 적색마연토기, 흑색마연토기, 흑색토기, 타날문토기 등은 민족지사례에서 제작하고 있는 토기와 상당히 닮아 있기 때문이다. 한반도에서는 신석기시대부터 토기에 음식을 조리하였으며, 청동기시대 이후에는 다양한 토기 제작기술을 통해 풍부한 토기 문화를 이루어왔다. 특히 원삼국시대가 되면 타날기술과 회전대(물레), 가마소성 등 제도기술의 유입으로 토기생산체제를 발달·성숙시켜 나갔다. 다수의 토기연구자들은 이와 관련된 토기제작기술을 다각적 연구를 통해서 복원해내고 있지만 여전히 그 해상도는 낮다고 할 수 있다. 이러한 민족지사례를 고대사회의 토기제작 기술로 대입할 수는 없지만 한반도 고대토기 생산 기술을 복원해 나아가는 데에 중요한 비교연구 자료가 될 것이다.",,,
387,영산강유역 대형옹관의 제작기술적 특징과 의미,"이지영, 최미숙, 이혜원 외 2명",(사)한국문화유산협회,야외고고학,2019,영산강유역 대형옹관의 제작기술적 특징과 의미,"고대 영산강유역 고분의 매장시설로 사용한 옹관은 초대형급의 크기로 인해 그동안 제작기술을 밝히기 위한 연구가 주목받아 왔다. 여러차례 제작실험을 통해 밝혀진대형옹관의 제작과정은 성형과 소성으로 크게 분리하여 살펴볼 수 있다. 성형은 점토띠를 쌓아 올리는 방식으로 외형을 잡고 표면을 다듬은 후 문양을 찍어 완성한다. 성형순서는 저부를 뒤집어 먼저 제작하고 반건조 과정을 거친 후 바로 세워 동체부와 구연부를 차례로 쌓아 올린다. 소성과정은 반지하식 가마를 축조한 후 내부에 옹관을 세워 넣고 70시간 정도 불을 때고 최고온도 900~1,100℃ 정도에서 불막음하여 완성한다. 대형옹관 기면에서 관찰되는 다양한 흔적과 복원실험 결과를 통해 살펴본 제작기술적 특징은 첫째, 대형기종에 적합한 제작방식을 채택하였다는 점이다. 성형과정에서는점토띠 쌓기, 저속 회전력, 반건조 방식 등을 이용하여 안정적인 기형을 유지하고자 하였다. 소성과정에서는 가마구조에 있어 높은 천장, 넓게 개방된 아궁이, 완만한 경사도를 갖춰 가마 내에 안정적으로 옹관을 놓고 균일한 온도를 유지하여 소성할 수 있도록 하였다. 둘째, 옹관의 형태와 크기가 정형화되고 상징적인 문양을 의도적으로 시문하였다는 점이다. 옹관 외면에는 기본적으로 격자문과 거치문이 타날되어 있고 바닥면중앙에 음각원문이 시문되어 있다. 이러한 문양의 기본구성은 영산강유역에서 대형옹관이 유행한 300여 년간 지속된 전통으로 지역적 특성으로 해석된다. 대형옹관의 생산은 대형기물 제작의 고도화된 기술력을 갖춘 전문 생산집단에 의해이루어졌다. 따라서 이를 운영한 지역 정치체의 존재를 상정할 수 있으며 동일한 제작기술적 특징을 갖춘 옹관의 매장풍습이 영산강 중·하류역을 중심으로 공유되었던 것으로 판단된다.",,,
388,우리나라 매장문화재 발굴조사 전문법인 등록제도의 변천과 개선,최민정,(사)한국문화유산협회,야외고고학,2019,우리나라 매장문화재 발굴조사 전문법인 등록제도의 변천과 개선,"우리나라는 1999년 1월 29일 문화재보호법이 일부개정 되면서 매장문화재 발굴조사 전문법인 설립의 법률적·제도적 기반이, 2005년부터 문화재보호법과 동법 시행규칙 개정을 통해 매장문화재 발굴조사 전문법인이 갖추어야 할 인력, 시설, 기자재 등의 기준이 도입된다. 문화재보호법에서 분법되어 2010년에 매장문화재 보호 및 조사에 관한 법률이, 2011 년에 하위법령과 행정규칙이 제정·시행되면서 매장문화재 조사기관의 종류, 등록 요건및 절차, 행정처분 등 등록제도가 체계적으로 정비·발전될 수 있는 계기가 마련된다. 하지만, 매장문화재 발굴조사의 공공성·투명성·객관성 제고와 학술성·전문성 강화, 매장문화재 발굴조사 전문법인의 건전한 운영과 역할, 건전성 유도를 위한 관리·감독, 국내 개발사업의 환경변화 등이 간과된 채 매장문화재 발굴조사 전문법인 등록제도나 법인설립 기본재산 요건 등은 2008년도의 완화된 제도가 그대로 유지되었다. 그 결과, 기존 매장문화재 발굴조사 전문법인의 분열을 통한 전문법인의 난립과 영세화, 저가수주와 과당경쟁, 갑을관계 심화, 직업 윤리의식 결여, 매장문화재 발굴조사 품질저하 및 부실조사 우려뿐만 아니라 조사기관 선정과 비용 결정 주도권을 가진 개발사업 시행자의 무리한 조사기간 단축과 비용 축소, 매장문화재 발굴조사의 전문성과 공익성, 가치와중요성에 대한 불신 등 악순환구조만 지속적으로 반복·재생되는 상황을 초래했다. 이러한 악순환구조를 선순환구조로 바꾸고, 시대적·환경적 변화를 반영한 선제적인 정책추진과 제도개선이 이루어지지 않을 경우, 매장문화재 발굴조사의 공공성·투명성 제고와 학술성·전문성 강화, 품질향상 등은 더욱 어려워질 것이다. 매장문화재 발굴조사 전문법인이 도산할 경우 현행 제도로는 도산한 매장문화재 발굴조사 전문법인의 보고서 미제출, 국가 귀속대상 유물 미이관, 국가 미귀속대상 유물의 보관·관리, 유물 보존처리 등의 문제를 해결할 수 있는 대책이나 다른 전문법인이 그 업무를 대행할 수 있는 제도적·정책적 장치도 없다. 따라서, 매장문화재 발굴조사 전문법인의 건전한 운영·역할과 발전, 경쟁력과 건전성유도·확보, 공공성·공익성 강화를 통한 매장문화재 발굴조사의 투명성·객관성·신뢰성제고, 학술성·전문성 강화, 품질향상 등을 위해서는 매장문화재 발굴조사 수행 가능면적및 용역수행 가능금액 기준을 설정하고, 그 기준에 따라 매장문화재 발굴조사 전문법인이갖추어야 할 전문인력 수, 기자재, 시설과 함께 신용평가등급 또는 보유 자본금(일반 순자산) 규모를 차등화 하는 방향으로 등록제도를 개선할 필요가 있다. 사회적·시대적 환경변화를 반영한 합리적인 매장문화재 발굴조사 전문법인 등록제도의개선과 관리·감독, 그리고 정책적·제도적 지원은 매장문화재 보호 및 조사에 관한 법률에서 규정한 매장문화재조사 전문기관의 육성·지원에 대한 국가의 책무를 이행하는 출발점이자 기초라고 할 수 있다.",,,
389,동북아시아 철겸의 변천과 완주 갈동유적 주조철겸의 등장배경,김상민,(사)한국문화유산협회,야외고고학,2019,동북아시아 철겸의 변천과 완주 갈동유적 주조철겸의 등장배경,"완주 갈동유적 2·3호묘에서 출토된 주조철겸은 연나라의 중심지에서 요령지역에 걸쳐 넓게 분포한다. 이 철겸은 연나라와의 관계 속에서 한반도로 유입된 것으로 평가되고 있지만, 한반도 남부지역에서는 한정적인 출토 양상을 띠고 있어 연구 대상으로 한계가 있다. 본고에서는 전국시대~전한대 동북아시아 철겸의 형식을 분류하고 시기와 지역에 따른 그 변화양상을 살펴보았다. 그리고 완주 갈동유적 주조철겸과 동일 형식의 철겸을 비교하여 그 특징을 살피며, 동북아시아 철기문화의 확산과정 속에서 완주 갈동유적 주조철겸의등장배경을 추정하였다. 이를 통해 완주 갈동유적에서 출토된 주조철겸은 화전 소황산둔, 무순 연화보유적의 주조철겸과 가장 유사하며, 위연 용연동유적 주조철겸과도 차이가 크지 않음을 확인하였다. 그 시기는 적어도 진한교체기의 어느 시점으로 여겨지는데, 동시기 요령지역에서는 철겸이 실제 사용되고 재활용되는 반면, 갈동유적의 경우 사용하지 않고 그대로 부장된다. 주조철겸은 연나라의 중심지와의 상호작용이나 이동에 의해 유입되는 것으로 연속성을보이지 않는 점은 향후 신중하게 해석하여야 한다.",,,
