,title,author,publisher,journal,date,translate_title,Abstract
225,'청주 소로리볍씨'의 오늘과 내일 -소로분교를 박물관으로-,"이융조, 우종윤",한국박물관학회,박물관학보,2020,'청주 소로리볍씨'의 오늘과 내일 -소로분교를 박물관으로-,"인류가 가장 먼저 가꾼 먹거리인 쌀은 밀과 함께 세계인의 2대 먹거리이며, 전 세계 인구의 절반 이상이 주식으로 먹고 있는 곡물이다. 이러한 쌀의 기원을 밝힐 수 있는 볍씨가 소로리유적에서 출토된 청주 소로리볍씨이다. 볍씨 출토지 일대는 4매의 토탄층이 매우 안정된 퇴적양상을 보이는데, 볍씨는 2토탄층에서 출토되었다. 볍씨와 토탄층을 미국과 한국에서 교차측정한 결과 17,000년 전의 연대값을 얻어 지금까지 세계에서 가장 오래된 볍씨임이 밝혀졌다. 그래서 청주 소로리볍씨를 “원조벼”로 부르고자 한다. 한편 고고학 교재로 세계에서 널리 읽히고 있는 Archaeology 제4판(2004년)부터 현재 7판(2016년)까지 세계에서 가장 오래된 “첫 순화벼(first domesticated rice)”로 청주 소로리볍씨가 소개되고 있어 세계학계에서 인정받고 있음을 증명한다. 청주시 심벌마크가 소로리볍씨를 문화원형으로 한 CI로 생명문화도시 청주의 상징기호로 정했음도 볍씨의 학술적 중요성이 인정된 결과물이다. 따라서 청주 소로리볍씨는 생태 및 역사체험자원, 교육자원, 문화산업자원, 관광자원, 장소 마케팅자원 등 생명문화도시 청주의 매래 자원으로 활용가치가 매우 높다고 할 수 있다. 볍씨 체험과 교육공간으로 볍씨가 출토된 소로리가 최적지이다. 이곳의 폐교된 옥산초등학교 소로분교를 청주 소로리볍씨 박물관으로 활용함이 타당한 주장이다."
226,1~3세기 挹婁의 考古 문화와 『三國志』 東夷傳의 挹婁,이승호,경희대학교 인문학연구원,인문학연구,2020,1~3세기 읍루의 고고 문화와 『삼국지』 동이전의 읍루,"본고는 현재까지 확보된 挹婁 관련 고고학 성과를 정리하고, 이를 바탕으로 1~3세기 읍루 역사에 대한 기초적인 검토를 시도할 목적으로 작성되었다. 특히 『三國志』 東夷傳의 읍루 관련 기사에 대응하는 고고 문화를 해명하는 데에 집중하였다. 읍루의 문화라 할 수 있는 고고 문화로는 오늘날 黑龍江 중·하류유역을 중심으로 하는 폴체-蜿蜒河 문화, 중국 三江平原의 滾兎嶺-鳳林 문화, 團結-크로우노프카 문화와 직접 동북 - 서남으로 연접해 있는 연해주 폴체 문화(올가 문화), 그리고 牡丹江 중·하류 유역을 중심으로 하는 東康 유형·東興 문화가 모두 그 대상이 될 수있다. 『三國志』 東夷傳의 挹婁 관계 기록은 王頎가 이끄는 魏軍이 挹婁의 남쪽 경계에까지 진군하면서 입수한 정보에 기초하고 있다. 이때 王頎의 부대가 조우한 挹婁 집단은 최종적으로 연해주 폴체 문화의 담당자들일 가능성이 크다. 연해주 폴체 문화는 北沃沮와 남북으로 인접하면서 동쪽으로 ‘大海(동해)’에 접해 있고, 우수리강과 綏芬河 수운을 통해북옥저 지역을 약탈할 수 있는 위치에 있다. 또 고지성 취락과 수혈식 주거지가 확인되어 문헌 기록을 통해 확인되는 읍루의 지리·문화적 특징 및 역사적 활동상에 대체로 부합한다. 다만, 경역이 수천 리에 달하고 그 북쪽 끝은 알 수 없다고 하였을 만큼 당시 읍루의범위가 광활하였다는 점을 고려하면,『 三國志』 東夷傳에서 지칭하는 挹婁가 반드시 현재 확인되는 어느 한 고고 문화에만 대응하여야 한다고 볼 필요는 없다.『 三國志』 東夷 傳에서 지칭하는 ‘挹婁’의 문화는 수천 리에 달하였다는 읍루의 경역 범위 안에서 폴체- 蜿蜒河 문화·滾兎嶺-鳳林 문화·연해주 폴체 문화 등 여러 문화를 모두 포괄하고 있었다고 볼 수 있다."
227,3~5세기 韓·中·日 연안항로의 운용과 변동,유호균,한국상고사학회,한국상고사학보,2020,3~5세기 한·중·일 연안항로의 운용과 변동,"아직 육상교통의 어려움으로 인해 해상 교통이 상대적으로 중요했던 고대, 한반도 서남해안 일대를 통과하여 쓰시마-일본열도로 이어지는 연안항로는 한·중·일을 잇는 유일한 국제 교통로였다. 여러 기록으로 볼 때, 적어도 3세기 무렵에는 서남해안을 통해 한·중·일 사이 국제교류가 이루어지고 있었다. 그러나 교류에 이용되는 서남해안을 통과하는 연안항로는 조수간만의 차와 복잡한 지형, 이로 인한 강한 조류와 같은 자연환경으로 인해 안전한 길이라고 할 수는 없었다. 따라서 서남해안 일대를 통과하기 위해서는 각 지역의 항로에 대해 잘 알고 있고 안전한 기항지를 제공할 수 있는현지 세력의 도움이 필요했다. 3세기 한반도 서남해안 일대는 마한·변한 등의 제국(諸國)들로 나뉘어 있던 상태로, 이들을 통합하여 아우를 수 있는 세력이 없었다. 때문에 연안항로 전체를 이용할 수 있었던 것은 중국의 선진 문물을 매개로 각 항·포구 세력의 협조를 얻어낼 수 있었던 한군현 뿐이었을 것으로 보인다. 이시기는 한군현과 중국 문물을 바탕으로 한 서남해안 연안항로를 통한 국제 교류의 성립기라고 볼 수 있다. 한군현과 중국 문물을 중심으로 교류가 이루어지던 서남해안 연안항로는 4세기 무렵, 한군현이 한반도에서 축출당하면서 변화를 겪는다. 교류의 매개체 역할을 하던 한군현이 사라지면서 국제교류가 쇠퇴하고 각지의 세력 사이에 분란이 발생하였다. 이 시기는 서남해안 연안항로의 쇠퇴기라고 할 수 있다. 한군현의 축출 이후 수십여 년간 이어진 서남해안 연안항로의 쇠퇴기를 끝낸 것은 백제세력이었다. 4세기 중반 무렵 백제는 북방의 고구려와 충돌하면서 후방을 안정화시킬 필요가 있었다. 이때 백제가 활용한 수단이 바로 중국의 선진 문물과 서남해안 연한항로였다. 『일본서기』(『日本書紀』) 등의 기록과 고고학 자료 등으로 볼 때 백제는 4세기 중반~후반쇠퇴했던 서남해안 일대의 연안항로의 복원을 통해 서남해안 일대의 항·포구 세력 및 왜와의 교류를 시도한 것으로 보인다. 백제가 이처럼 서남해안 연안항로의 복원을 시도할 수 있었던 것은 한군현의 축출 당시 흡수한 중국 계통의 유이민과 이들이 향유했던 선진 문물 덕분이었던 것으로 보인다. 백제의 주도하에 복원된 서남해안 연안항로는 단순히 그대로 유지된 것이 아니라 이후변화를 거듭했다. 5~6세기, 백제는 고구려와의 대립 구도에서 열세에 처하는 한편, 왜와적대 관계였던 신라가 남해안 일대에서 세력을 확장하는 등 동북아 국제정세는 큰 변화를겪는다. 그럼에도 불구하고 5세기 이후에는 서남해안 연안항로를 보다 유연하게 활용할 수있게 되면서 백제와 항·포구 세력들의 교섭이 확대되었다. 이를 통하여 국제정세의 변화에도 불구하고 서남해안 연안항로는 변동을 통해 국제 교통로로써 생명을 이어갈 수 있었다. 4세기 중반 이후는 서남해안 연안항로의 복원·변동기라고 할 수 있다."
228,토기와 위신재로 본 부여의 성립과교류 네트워크,윤정하,한국상고사학회,한국상고사학보,2020,토기와 위신재로 본 부여의 성립과교류 네트워크,"이 논문에서는 기원전 4세기에서 기원후 4세기까지 길림성 중부 지역을 중심으로 한 중국 동북지역에서 출토된 고고 자료를 바탕으로 토기기종조합의 분포권역과 위신재 교환범위의 차이를 식별했다. 이를 통해 당시 해당 지역에 존속했다고 여겨지는 부여 정치체의 형성 메커니즘과 교류 네트워크전개과정을 살펴보았다. 이 논문에서 토기문화권과 위신재 교환권역의 차이를 확인하고자했던 이유는 첫 번째로 부여와 유사한 연맹왕국 단계에서는 국가 전역에서 통일적인 토기 양식이 보이지 않기 때문이다. 부여를 지방을 장악해가는 영역화 과정을 통해 국가를 성립한 것이 아니라 ‘공동 정치화 전략’에 의해 성립기부터각 지역의 독립적 성격이 인정된 상태에서 국가가 성립된 연맹왕국의 형태로 보아, 중앙집권국가와는달리 중앙의 특정한 토기군이 여타 다른 지역의 토기군을 대체하기 힘들었던 것으로 파악했다. 두 번째로 기원전 4세기까지 길림성 중부 지역은 위신재 교환권역에서 주요 지역이 아니었기 때문에 부여가 성립되는 시기 이 지역의 위신재 교환 관계를 확인하는 것이 의미 있다고 판단했다. 고고자료를 토대로 이 지역의 정치체는 고조선이 주도하는 위신재 교환 네트워크에 적극적으로 가담하지는 않았던 것으로 추정할 수 있다. 그러나 고조선의 위신재 교환 네트워크 붕괴 이후이자 부여 성립기로 추측되는 기원전 3~2세기경이 되면 이 지역을위주로 발견되는 형태의 이식이나 검이 거리가 떨어진 유적에서 발견된다. 이러한 정세를토대로 부여 국가체가 태동함에 따라 위신재 교환 네트워크가 형성된 것을 알 수 있다. 상술한 연구의 필요성을 바탕으로 토기/위신재 기종별 형식분류를 진행하여 총 4기로 획기했으며, 시기별 소지역권을 구별했다. 결론적으로 부여의 대내외 교류 네트워크에 대한연구를 통해 부여의 지방자치적 성격을 확인할 수 있었다. 부여 정치체는 각 소지역권이 형성되고 독자성이 존속하는 상태에서 중거리 집단의 지배계층 간의 정치적 관계로 국가체가유지되었다. 그리고 문헌사 연구에서 다뤄지는 것과 달리, 이 논문에서는 고고자료상 사출도는 중앙에서 임의적으로 편성된 구역이 아니라 부여 형성 이전에 존재했던 집단공동체중 큰 규모의 공동체가 이후 교통과 대외관계의 거점지로서 역할을 하며 점차 자원이 집중되자 이후 각 지방의 통치 중심지로까지 역할 했다는 것을 밝혔다."
229,동해안지역 신석기시대 석촉의 형식 분포와 변천,최종휴,한국신석기학회,한국신석기연구,2020,동해안지역 신석기시대 석촉의 형식 분포와 변천,"본고는 동해안지역 신석기시대 석촉을 분류하고, 시간적·공간적 분포양상을 분석하고자 작성되었다. 석촉의 형식은 제작방법과 평면 형태를 기준으로 분류하였다. 형식에서 지역성이 확인되는 케이스는 타제 ⅠC형뿐으로 동해안지역의 신석기시대 석촉은 아직 지역성을 규정하기 어렵다고 판단하였다. 동해안 남부지역 석촉은 북부, 중부와는 형식적으로 단절되었고, 동해안 북부지역과 동해안 중부지역의 석촉은 세장한 형태로 점차 변화된다. 중기 무렵부터 소형과 대형으로 분화되며, 중기 후반부터 소형 석촉이 급증한다. 동해안 중부지역은 마제석촉이 일찍부터 다수 제작되었으며, 흑요석과 사누카이트 등 산지가 제한적인 돌감을 구하기 어려웠던 입지도 동해안 중부지역에서 마제석촉만 지속적으로 사용되는 현상에 영향을 끼쳤다고 보았다. 신석기시대 중기에는 용도와 기능에 따라 다른 형태의 석촉이 제작된다. 비거리를 늘리는데 목적이 있는 경우 소형의 석촉이, 피해범위를 증가시키고 물의 저항을 덜 받는데 목적이 있는 경우 가늘고 긴 석촉이 제작되었다."
230,절대연대측정을 이용한 고고유적에서의 인간활동 복원,김명진,한국물리학회,새물리,2020,절대연대측정을 이용한 고고유적에서의 인간활동 복원,"이 연구에서는 공주 계실리 유적에서 발굴조사된 다양한 고고학 유구에 방사성탄소 연대측정과 TL/OSL 연대측정, 고지자기 연대측정을 적용하여 각 유구의 절대연대편년을 우선 산출하였다. 이후 각 유구의절대연대편년을 KDE 모델을 이용하여 누적한 후 정규분포를 이용하여 피크 분리한 결과, 공주 계실리유적에서는 통일신라시대인 840 160 AD (1 SD)에 최초로 인간활동이 시작되었으며, 고려시대인1,250 160 AD (1 SD), 조선시대 후기인 1,670 180 AD (1 SD) 순으로 인간활동이 활발히 지속되었다고 판단되었다. 이중 슬래그 퇴적층을 포함하여 제철 및 제련시설과 관련된 것으로 추정되는 조선시대후기 유구들은 유적 내에서 등고선에 수직하게 입지하였다. 이러한 유구의 공간분포는 제철 및 제련작업이상부의 소성유구에서 행해졌고, 이 과정에서 생성된 슬래그를 유적 하부의 저지대에 자연스럽게 폐기했음을암시한다."
231,17세기 류응원 무덤 출토 木函의 성격과 의의 : 조선시대 禳鎭重喪法의 실제,이종철,호남고고학회,호남고고학보,2020,17세기 류응원 무덤 출토 목함의 성격과 의의 : 조선시대 양진중상법의 실제,"본 글의 목적은 전라북도 완주군 봉동읍 둔산리를 본향으로 하며, 전주류씨 진학재공파 4세손인 류응원(柳應元)의 무덤에서 출토된 목함(木函)과 주서(朱書)의 성격을 고찰하는 데 있다. 발굴조사 이후 22년 동안 성격 미상의 함으로 보관되어 왔다는 점에서 의미있는 작업이 아닐 수 없다. 필자는 목함 내부에 쓰여진 육경천형(六庚天刑)이라는 주서를 통해 세간에 알려져 있는 양진중상법의 실제로 파악하였다. 양진중상법의 유래에 대해서는 아직까지 분명하지 않지만, 중국으로부터 전해진 것으로 이해된다. 특히 실물자료로 학계에 보고된 일이 없어 류응원의 목함은 중요한 고고학적 자료로 평가된다. 그 학사적 의미는 다음과 같다. 첫째, 목함은 1637년의 것으로 연대가 확실한 첫 고고학적 사례이다. 둘째, 종이가 아닌 목함 자체에 주서를 직접 썼다는 점에서 특기할 만하다. 셋째, 류응원의 사망월이 음력 3월인데 기존의 육신천정이 아닌 육경천형으로 바뀐 것은 15세기 조선의 천문역법 등 과학 분야의 변화와 무관하지 않을 가능성이다. 류응원에 대한 자료의 부족으로 좀 더 밀도 있는 접근이 시도되지 못한 점과 양진중상법의 구성원리 및 언제, 어떤 경로를 통해 보급되었는지에 대한 세부적인 연구는 향후 과제로 돌리고자 한다. 앞으로 이러한 고고학적 사례들이 더 많이 축적되어 양진중상법의 해상도를 높이는 데 기여하기를 고대한다."
232,영산강 유역 원통형토기의 제작 집단 검토,김수빈,한국고고학회,한국고고학보,2020,영산강 유역 원통형토기의 제작 집단 검토,"일본의 원통하니와(圓筒埴輪)와 기형이 유사한 ‘원통형토기’는 장송의례의 목적으로 제작된 토기로 한반도에서는 주로 영산강 유역의 분묘 유적을 중심으로 출토되는 양상을 보이고 있다. 일부 선행 연구에서 제작 기법을 언급하거나 실험고고학을 통하여 제작 공정을 복원하였지만, 대부분이 속성 연구에 치중되어 고고학적 접근에 한계를 드러내 왔다. 본고에서는 이러한 선행 연구를 보완하고자 출토 사례가 증가하고 있는 영산강 유역의 자료를 대상으로 선정하여, 원통형토기의 제작 기법을 분석한 내용을 바탕으로 제작 집단의 성격을 추정해 보았다. 전체적으로 외형에 영향을 주는 투창이나 돌대 등 장식적인 요소가 거의 관찰되지 않는 I식 원통형토기는 정립 기법과 분할정립 기법을 중심으로 제작되었다. 획일적이지 않고 다양한 기형이 확인되며 같은단계에서도 다른 제작 기법을 이용하여 만들어진 원통형토기가 출현하기도 한다. 따라서 I식은 중앙의 통제를 받지 않은 재지세력을 중심으로 ‘독립적으로 전문화’된 비전업-반전업의 성격을 띠는 공인이 제작하였다고 추정되므로 외부 영향적인 의미보다는 자생적인 의미에 초점을 두어야 할 것이다. II식 원통형토기는 분할도립 기법과 도립 기법이 관찰되며, I식과 단계적으로는 이어지지만 기형과 성형 기법 및 소성도에서 큰 차이를 보이기 때문에 계승 관계가 없다고 판단된다. 또한 수량이 증가하며 획일성이 높아지기 때문에 중앙과 관련있는 일련의 생산 시스템을 공유한 ‘부속된 전문화’적인 전업의 성격을 띠는 공인이 제작하였다고 추정된다."
233,토기를 통해 본 청동기시대 사회상,이수홍,부산고고학연구회,고고광장,2020,토기를 통해 본 청동기시대 사회상,"가장 많이 잔존하는 고고자료인 토기를 활용해 청동기시대 사회상에 접근하고자 하였다. 기존의 토기 연구가편년에 집중되어 있었는데, 편년 이외 토기를 통해 무엇이 밝힐 수 있는지에 대한 검토이다. 토기의 표면에 잔존하는 흑반의 관찰을 통해 어떻게 소성되었는지, 그을음과 탄착흔의 관찰을 통해 어떻게취사하였고, 어떤 음식을 조리하였는지에 대해서 접근할 수 있다. 토기의 기종 차이는 지역성을 나타내기도 하는데, 생업의 차이를 반영하는 것이다. 동일한 기종이라도 기형이나 문양에서 지역성을 보인다. 동남해안지역의 검단리식토기, 부산지역의 연지동식토기, 호서지역의 플라스크형 적색마연토기, 경남지역의 함안식적색마연토기, 서부경남과 동부전남지역의 채문토기는 특정지역에서만출토되어 지역상을 보인다. 돌대문토기, 횡대구획문토기, 타날문토기, 점토대토기는 이주의 결과 한반도 남부지역에 출현하였으며, 파수부 심발형토기, 파수부 적색마연토기, 플라스크형 적색마연토기는 주민의 왕래에 의해 인접한 곳으로 전파되었다. 토기의 분포권을 집단과 연결시킨 최초의 사례는 고조선의 표지적인 유물로 인식되어 온 미송리형토기이다. 최근에는 점토대토기를 고조선과 연결시키기도 한다. 집단의 정체성에 대한 연구는 고고학에서 끊임없이 추구해야 할 연구 분야지만 신중을 기할 필요가 있다."
234,완주 봉림사지 기와의 변천과 후백제,차인국,호남고고학회,호남고고학보,2020,완주 봉림사지 기와의 변천과 후백제,"후백제는 통일신라시대 후기부터 최소 37년 이상 존속한 나라이지만, 그에 대한 고고학적 성격은 아직 명확하지 않다. 이러한 상황에서 본고는 후백제의 여러 물질자료중 평기와의 특징을 파악하기 위해 작성되었다. 이를 위해 후백제의 왕실사찰로 비정되는 완주 봉림사지 출토기와를 분석하여 변천양상을 파악하고, 후백제의 기와를 특정하였다. 그 결과 봉림사지의 기와는 4기로 구분할 수 있는데, 1기는 후백제가 등장하기 이전인 7세기 후반~9세기 중반에 해당한다. 기와의 특징으로는 단판과 중판 타날판, 내면하단부 깎기조정을 들 수 있다. 2기는 9세기 중반에서 10세기 초반이며, 후백제의 존속시기와 일정부분 일치한다. 이 시기의 기와는 ‘장판타날판+내면하단부 無조정’, ‘장판타날판+내·외측 와도질’이 표지적이며, 그 밖에 내면하단부 깎기조정과 와도질 방향의 양쪽 외측, 혹은 양쪽 내측도 가능하다. 3기는 후백제멸망 이후인 10세기 중반~12세기 후반으로 기와는 ‘토수기와+내면하단부 물손질조정’이 특징적이다. 4기는 경복궁에서 출토된 기와의 문양과 비교하여 조선시대 전기로 추정하였는데, 미구기와가 토수기와를 대체하며, 내면하단부에는 물손질조정이 계속된다. 이중 후백제 기와는 유물의 시·공간적 배경을 토대로 2기에 해당하는 모든 기와를 상정하였는데, 일부 문양은 후백제의 또 다른 유적으로 알려진 전주 동고산성과 광양 마로산성 출토품과 유사한 것을 알 수 있었다. 한편 1기의 기와는 후백제가 등장하기 이전에 제작된 것이나, 전주 동고산성의 기와양상과 비교하여 후백제에 의해 (재)사용이 이루어졌을 것으로 추정하였다."
235,세형동검문화의 동부와 도끼ㆍ자귀,"조진선, 김주호, 노형신",한국청동기학회,한국청동기학보,2020,세형동검문화의 동부와 도끼ㆍ자귀,"세형동검문화의 청동제 목공구로는 동부와 동착이 있다. 동착은 단순하지만 동부는 선형동부와 유견동부, 장방형동부, 주머니형동부로 다양하다. 이 중 합인인 주머니형동부를 제외한 나머지는 모두 편인이다. 필자들은 민족지 자료를 검토하는 과정에서 1960년대까지 신석기시대 농경민의 삶을 살고 있었던 뉴기니의 두굼 다니가 돌도끼는 나무를 쪼개는 데 사용했고, 자귀는 나무를 베고 다듬는 데 사용한사실을 확인하였다. 이에 따라 필자들은 장방형동부를 도끼와 자귀로 착장해서 나무 베기 실험을 진행하였는데, 자귀로 사용했을 때 훨씬 더 효과적이라는 사실을 확인하였다. 이러한 양상은 두굼 다니의사례, 그리고 돌도끼와 돌자귀로 나무 베기를 진행한 실험고고학적인 연구 결과와도 상통한다. 즉, 장방형동부는 나무를 벨 수도 있고 다듬을 수도 있는 자귀여서 長方形銅錛이라는 명칭이 더 적합하다. 나아가 세형동검문화의 동부들은 합인인 주머니형동부를 제외한 나머지는 모두 자귀여서 有肩銅錛, 扇形 銅錛으로 부르는 것이 타당하다. 한국 고고학계에서는 목공구의 명칭을 총칭해서“斧”로 쓰거나“斧”와“鑿”으로 이원해서 쓰는 경향이 강하다. 하지만 이러한 목공구 명칭은 현대 대목장의 연장인 도끼, 자귀, 끌이나 18세기에 편찬된『才物譜』의 斧(독긔), 錛子(자귀), 鑿( )이라는 명칭과 달라서 대중들의 인식과 괴리되어 있다. 그래서 한국 고고학계에서도 목공구의 명칭을 도끼(斧), 자귀(錛), 끌(鑿)과 같이 전통적이면서도 현대적이어서 대중들이 이해할 수 있는 명칭으로 수정해야 할 것이다."
236,동해 송정동유적으로 본 “실직국”에 대한 斷想,심재연,경희대학교 인문학연구원,인문학연구,2020,동해 송정동유적으로 본 “실직국”에 대한 단상,"동해 송정동유적은 “실직국(悉直國)”의 존재를 증명하는 중요한 유적으로 알려져 왔다. 그러나 신라의 실직주(悉直州) 설치와 “실직국”의 상호 연관성을 살피기에는 한계가 있음을 확인하였다. 특히, “실직국”의 영역을 신라통일기 이후에 형성된 삼척의 영현(領縣)을 근거로 고고학적 유적을 배치하는 것은 재검토가 필요하다. “실직국”의 존재를 증명하기 위해서는 “실직국”의 영역으로 비정된 유적을 중심으로 지역성을 보여주는 유물과 유구의 양식이 변별될 필요가 있다. 그리고 문헌에 등장하는 “임둔”과 “예”를 근거로 종족성을 논하기에는 고고학적 물질 자료에 한계가 있다. 삼척 일원에 존재하였다고 전해지는 “실직국”은 동해 송정동유적의 집단이 영남지역과의 활발한 상호작용을 하던 시기의 모습이 신라(사로국)인에게 투영된 것이 반영된 것으로 판단된다."
