,title,author,publisher,journal,date,translate_title,Abstract
114,신석기시대 한반도 刺突漁業의 전개와 성격,배형곤,한국고고학회,한국고고학보,2021,신석기시대 한반도 자돌어업의 전개와 성격,"본고의 목적은 신석기시대 한반도 자돌어업의 성격을 밝히는 것이다. 이를 위해 자돌어구의 기능적 속성에주목하여 기종을 재검토한 뒤 형식을 분류하고 시·공간적 전개 과정을 살펴보았다. 아울러. 자돌어업 방식을유추하기 위해 유적별 자돌어구와 동물유체의 공반관계를 살펴보고, 직접 및 민족지자료를 참고하여 양자의관계를 입증하고자 하였다. 그 결과, 고정식작살은 한반도 자돌어구의 중심 기종으로 찌르개, 분리식작살에 비해 높은 비중을 차지한다. 전반적으로 자돌어업은 신석기시대 조기와 전기에 동·남해안지역을 중심으로 성행하였고, 중기가 되면남해안지역 동부와 동북부지역으로 축소된다. 이러한 경향은 후기와 말기로 갈수록 점차 두드러진다. 그렇지만 오히려 동삼동 유적과 서포항 유적은 이 시기에 집중적인 자돌어업이 이루어졌던 것으로 보인다. 나아가 한반도 신석기시대의 자돌어업은 고정식작살, 분리식작살, 찌르개를 이용하여 해수류와 어류를포획하였을 개연성이 짙다. 특히, 자돌어구와 해수류의 밀접한 연관성을 비추어 볼 때, 기각류 가운데 ‘강치’ 를 주 대상으로 포획했을 것이다. 강치의 경우 근접 포획할 수 있어 고정식작살 또는 찌르개를 사용하는 것이가장 유효했기 때문이다. 북일본과 비교해 기술형태학적으로 古式의 분리식작살이 지속해서 사용되어 온 사실 또한 이를 뒷받침하는 근거이다. 즉, 근접 포획에 적합한 생태환경은 분리식작살 발달의 원동력을 만들어내지 못했고, 이는 한반도의 특징적 자돌어업 문화를 형성하게 된 배경으로 작용했을 것이다."
115,5~6세기 진주지역 토기양식의 특징과 매장의례의 변천,여창현,한국고고학회,한국고고학보,2021,5~6세기 진주지역 토기양식의 특징과 매장의례의 변천,"진주지역의 후기 가야 토기양식이나 집단의 변천에 관한 연구는 소가야양식 토기 범위라고 일컫는 고성을 포함한 남해안 일대와 경남 서부지역을 아우르는 넓은 범주에서 연구되어 왔다. 필자는 최근의 발굴 성과를 반영하여 시기별 진주지역 토기양식의 특징을 살펴보고, 이를 토대로 주요 고분군의 성립과 변동에 따른 토기조합유형을 중심으로 매장의례의 변천과 고분군 축조 집단의 성격을 밝혀 보고자 하였다. 먼저 토기 형식분류를 시도하고, 시기별 변화와 특징을 6단계로 구분하여 살펴보았다. 진주지역 토기양식의 성립(Ⅰ~Ⅱ단계)은 아라가야의 지배층 무덤으로 알려진 말이산 고분군 내 잔자갈 관상을 설치한 대형목곽묘와 전환기 토기류의 영향을 받은 것으로 추정된다. 이후 5세기 후반에서 6세기 초 무렵(Ⅲ~Ⅴ단계)까지 토기복합체의 구성과 함께 특징적인 토기 조합유형이 나타나고, 다곽식 묘제의 출현과 토기제사법의 성립과정 속에서 일련의 매장의례가 공유된다. 5세기 후반까지 무촌 고분군 축조 집단은 생산(상촌리 토기 가마)· 유통 체계(고분군·소하천)가 형성되면서 중심고분군으로 성장하였고, 6세기가 되면 다곽식의 고총 고분이 축조되는 무듬산 일대의 가좌동 고분군이 중심고분군으로 대두된다. 고총 고분의 성립과 함께 토기 조합유형은더욱 정형화되고, 토기제사법은 봉토의 외부까지 확대되어 행해진다. 이후 토기양식이 쇠퇴·소멸(Ⅵ단계)되면서 새로운 묘제인 횡혈식석실묘가 도입되고, 정형화된 토기 조합유형과 매장의례는 사라지고 중심고분군은 수정동·옥봉 고분군으로 이동된다. 진주지역의 고분군 축조 집단은 한 세기 동안 특징적인 토기복합체를 무덤에 소비·부장하고, 정형화된 토기 조합유형을 매개로 매장의례를 공유하면서 변천한다. 또한 매장의례의 변화는 목곽묘에서 수혈식석곽묘로의 전환, 다곽식석곽묘의 성립, 새로운 묘제인 횡혈식석실묘의 출현 등 묘제의 변천과 깊게 관련된다."
116,[비평논문] 탄소연대를 이용한 신석기시대 인구변화 복원: 방법론적 고찰,김민구,한국고고학회,한국고고학보,2021,[비평논문] 탄소연대를 이용한 신석기시대 인구변화 복원: 방법론적 고찰,"선사시대 인구변화와 관련한 최근 연구경향 중 하나는 방사성탄소연대의 합산확률분포(SPD)를 이용하는 것이다. 하지만 동시에 이런 접근법에 대한 회의적인 시각도 존재한다. 본고에서는 탄소연대의 시뮬레이션에근거하여 몇 가지 문제점을 실증적으로 제기하였다. 합산확률분포가 인구의 정체현상을 반영하지 못하는 점, 확률변화와 인구변화 폭이 비례하지 않는 점, 소위 “가장자리 효과”가 인구유입과 소멸시점 확인을 난해하게하는 점, 보정곡선에 의해 생겨난 확률상의 무의미한 증감이 자료의 확대해석을 유도하는 점 등이다. 한국 신석기시대 유적에서 측정된 탄소연대 합산확률을 검토한 결과, 신석기시대 인구가 4000 BC경부터 증가하며3000 BC 이후 줄어들었다는 대체적인 추세를 확인할 수 있었다. 하지만 인구증감의 정도는 합산확률이 나타내는 비율과는 차이가 있을 것으로 판단된다. 또 주민의 등장과 소멸 시점을 정확히 단정짓기는 어렵다. 본고의 분석은 합산확률에 대한 과도한 해석은 지양되어야 하며, 인구변화 추세에 대한 해석은 보정곡선의 기울기와 형태에 대한 고려와 병행되어야 함을 나타낸다."
117,寬倉里遺蹟의 編年과 變遷,안재호,부산고고학연구회,고고광장,2021,관창리유적의 편년과 변천,"호서해안지역의 대표적인 송국리문화 유적인 보령 관창리유적의 형성과정을 통하여 사회상을 재검토하고자한다. 유적에서 출토된 유물을 분류하고, 순서배열보충법으로 작성된 양식편년에 따라 주거지를 3시기로 나누었다. 관창리취락은 수전을 기반으로 한 농경사회이지만 수렵채집문화도 공존한다. 무덤은 취락 내부에 발견되지만, 별도의 구릉에도 묘역을 조성하였다. 그리고 중국의 제도술을 도입하면서, 토기가마를 한 곳에 모아두고 그주변에 고상창고와 공방을 갖춘 반전업적 생산체제를 갖춘 점이다. B지구가 중심지역이면서 3개의 구역(A~C) 으로 나누어진다. Ⅰ기취락은 B지구 A구가 중심이며 1동의 대형가옥이 존재하지만 소규모에 불과하다. Ⅱ기에는 B구에 토기가마가 조영되면서 확장되지만, A구는 축소한다. 2동의 대형가옥이 A·B구에 등장한다. Ⅲ기가 되면 A구는 쇠퇴하고 2개 구역으로 재분할된 B구에 대형가옥은 구릉의 최상부에 1동, 특수건물이 입지하는 낮은 곳에 각 1동씩분포한다. 이 시기는 수장이 등장하기 직전으로서 취락 구성원 사이의 계서와 귀속지위가 인정된 사회였다"
118,강원 영동지역의 이른바 大加耶人 徙民의 실상,김규운,한국고고학회,한국고고학보,2021,강원 영동지역의 이른바 대가야인 사민의 실상,"삼국시대에 특정 양식의 토기의 유통, 확산을 통해 경제권, 문화권 나아가 정치적 영역에 이르기까지 다양한논의가 진행되었다. 그러나 강원 영동지역에서 토기 제작기법의 전수 혹은 공방의 생산시스템 전파, 생산 토기의 유통, 영역의 확장 등 기왕의 접근으로는 해석이 불가능한 양상을 보이는 대가야양식 토기가 출토되었고, 이를 대가야인의 사민으로 상정해 왔다. 사민이라고 하는 해석 자체에 대해서는 크게 이견이 없으나 대가야양식 토기를 면밀히 관찰한 결과 그양상이 간단하지만은 않았다. 같은 대가야양식 토기의 범주에 속하지만 개배는 전형적인 대가야양식 토기로, 중심지인 고령지역에서 생산한 것이다. 반면, 대가야양식의 대부장경호에는 모두 동체 하위에 평행 혹은 격자 타날흔적을 지우지 않고 남기고 있음을 확인하였다. 소가야양식 토기 제작기법을 그대로 이용하고 있는것이다. 이러한 대부장경호는 주로 소가야의 권역, 혹은 토기 문화와 관련 있는 지역이었다가 이후 대가야의영향권으로 들어가는 지역에서 확인된다. 즉, 이 동체부 하위의 타날흔을 통해 대부장경호는 소가야양식 토기의 제작기법으로 대가야양식 토기를 모방생산한 것임을 확인하였다. 결국 두 기종의 생산지가 다르므로 대가야의 멸망에 따른 중심지의 사람이 사민된 것이라는 기존 견해에대한 수정의 필요성을 지적하였다. 사민의 양상을 정리하면 삼척·동해지역은 6세기 이후 실직주 설치를 통해 신라가 거의 직접지배를 통치하는 곳으로 대가야를 멸망시킨 이후 이 지역으로 대가야인을 사민시킨다. 이 사민된 대가야인은 대가야 중심지의 사람이 아니라 외곽의 소규모 지배집단의 사람으로 사민된 이후에도 현지의 지배자급과 비슷한 랭크를 유지하게 된다. 완전히 굴욕적으로 강제이주되는 모습보다 기존의 지위를 어느 정도 보장하면서 새로운지역으로 이동하게 되는 모습을 그릴 수 있었다. 이는 신라의 입장에서도 두 지역에 대한 지배력을 모두 높이는 효과로 이어진다."
119,4세기 김해지역 토기생산체계의 전이,안한솔,한국고고학회,한국고고학보,2021,4세기 김해지역 토기생산체계의 전이,"영남지역에서 3세기 후반 도질토기의 출현은 새로운 생산체계의 등장을 의미하며 4세기에 이르러 기존의 토기 생산체계를 대체한다. 이러한 과정은 함안, 김해, 그리고 경주 등지의 영남 전역에서 확인되며, 그 전개의시기와 양상은 지역마다 다르다. 특히 김해·부산지역은 대형고분군의 조사 및 연구성과가 풍부하여 2~5세기에 걸치는 여러 고분군이 확인된 바 있다. 시기적으로 공백이 적으며 비교적 안정된 편년안 역시 확립되었기에 와질토기가 도질토기로 전환되는 과정을 살펴보는 데 적절하다. 기존 연구에서 와질-도질토기 생산체계의 대체·통합과 관련하여 일정 부분의 논의가 이루어진 바 있으나, 두 생산체계의 공존에서 통합에 이르는 일련의 과정에 대해서는 구체적으로 규명된 바가 없다. 이와 같은 문제의식을 바탕으로 4세기 김해지역 토기생산체계의 전이 과정을 해명해 보고자 했다. 4세기의 주요 기종인 타날문단경호와 노형토기·노형기대를 대상으로 작업연쇄를 분석하여 본 결과 각각A~E와 a~d로 분류할 수 있었다. 다음으로 3세기 후반부터 4세기에 걸친 토기유물군의 변화를 크게 Ⅰ~Ⅲ단계로 나누었을 때, 각 단계의 작업연쇄 및 제작전통의 변화는 다음과 같다. 제Ⅰ단계에 새로운 생산체계와 작업연쇄의 출현을 보았다면, Ⅱ단계에서는 도질토기 생산체계가 와질토기 생산체계를 능가하여 확장됨으로써두 생산체계가 통합되어 가는 과정을 볼 수 있다. 각 단계의 작업연쇄들이 변해 가는 양상을 검토해 본 결과, 김해지역에서는 와질토기와 도질토기의 제작전통을 각각 유지한 별도의 생산조직이 존재했으며, 이러한 개별 생산체계는 상호 영향을 주고받으며 공존하다 최종적으로 도질토기 생산체계로 흡수·통합된 것으로 생각된다. 토기생산체계의 변화, 유통 문제의 이면에는 그것을 만들어 낸 기술이 있다. 따라서 생산체계의 관점에서어떻게 기술을 규명하고 해석할 것인지에 대한 논의는 앞으로 더욱 중요하며 꾸준한 고민과 검토가 요구된다."
120,"신라 중심부의 정치사회사 구축을 위한 고분과 고분군의 연구 –『신라 6부의 고분 연구』 (최병현 지음, 2021, 사회평론아카데미)",이성주,한국고고학회,한국고고학보,2021,신라 중심부의 정치사회사 구축을 위한 고분과 고분군의 연구,
121,백제 사비도성의 기와 생산과 가마 운영,이솔언,한국고고학회,한국고고학보,2021,백제 사비도성의 기와 생산과 가마 운영,"본고에서는 백제 사비기 기와가마 구조와 생산된 기와를 분석하여 그 변천양상을 살펴보고, 가마별 기와의생산·공급과 단계에 따른 가마 운영을 파악해 보았다. 사비기 기와가마는 구조에 따라 9개의 형식으로 분류한 후 이를 바탕으로 3개의 단계를 설정하였다. Ⅰ 단계에는 횡염등요가 확인되고, Ⅱ단계에는 중국 북조와의 교류로 반도염평요가 새롭게 등장하며, 이와 함께반도염등요도 등장한다. Ⅲ단계에는 반도염 등요와 평요가 지속되며, 배부른 제형의 소성부가 새롭게 등장한다. 이는 한 번에 많은 기와를 소성하고자 내부 소성공간을 개선한 결과로 보인다. 기와는 선문 타날판과 토수기와의 사용, 외면→내면 방향으로의 분할방법(Ⅰ～Ⅱ단계)이 제작의 경제성과, 타날문양 단순화, 인장와의등장(Ⅲ단계)이 체계적이고 전문화된 제작시스템의 정립과 관련된 것으로 볼 수 있다. 이는 기와의 효율적인생산을 위해 먼저 기와 제작의 변화가 시작되었고, 나아가 가마의 구조 변화까지 이어진 것으로 보인다. 이를 바탕으로 기와 생산과 가마의 운영 양상을 파악해 보면, 사비기 전반(Ⅰ～Ⅱ단계)에는 기와 생산이 확대되고 가마는 주로 단기적으로 운영된 것으로 추정된다. 도성 내부 시설이 조성됨에 따라 점차 기와의 대량생산이 요구되면서 기와 제작공정은 노동력과 시간을 줄이는 방향으로 변화하고, 가마에서도 반도염평요의수용 등 변화가 나타났다. 가마는 주로 전용공급으로 단기적인 조업이 이루어졌고, 기와 제작집단은 그 수가많지 않았으며 필요에 따라 재배치되기도 했다. 사비기 후반(Ⅲ단계)에는 기와 생산의 체계화와 가마 운영의조직화가 진전되었다. 가마는 반도염등요로 정착되었고, 기와의 제작은 인장와의 생산 등으로 체계적이고 일원화된 제작시스템이 정립되었다. 또한 공용공급을 위한 가마가 확대되었는데, 늘어나는 기와 수요에 대응하기 위해 가마는 장기 조업이 이루어지기도 했으며, 이에 따라 가마 운영도 좀 더 조직화된 것으로 보인다."
122,4~6세기 찰갑을 통해 본 한일 교류,김혁중,한국고고학회,한국고고학보,2021,4~6세기 찰갑을 통해 본 한일 교류,"그간 고대 한일 간 교섭과 교류를 주제로 한 연구 성과는 적지 않다. 특히 금속 제품은 한일 기술 교류의 측면에서 주목할 수 있는 자료이다. 본고가 검토 대상으로 한 갑주와 같은 무구에 관해서도 고대 한일 관계를 살펴보는 기초적 자료 검토가 이루어진 바 있다. 그러나 이 시기의 고대 갑주 연구는 4∼5세기대에 출토된 판갑으로 주제가 한정되어 당시 사회문화상을살펴보기 어렵다. 이에 필자는 또 다른 주요 갑옷인 찰갑을 대상으로 하여 한일 양국 기술 교류의 기초적 검토를 해 보았다. 이를 위해 본고는 삼국시대 찰갑 자료가 많이 축적된 영남지방 출토 자료를 중심으로 찰갑의변천과 특징을 살펴보았으며 이를 일본지역 출토 자료와 비교하였다. 고대의 찰갑은 여러 형태의 소찰을 엮어 만든 것으로 부위별로 다양한 특징이 있다. 그중에서 허리 부분에 해당하는 요찰은 단면 형태 변화에 큰 특징이 있다. 요찰 단면이 ‘Ω’자형인 찰갑은 그간 고대 일본 고유의찰갑으로 인식해 왔다. 그러나 최근 국내에서도 적지 않은 자료가 확인되어 이를 검토해 본 결과, 요찰 단면이 ‘Ω’자형인 찰갑은 한반도의 제작 시기가 다소 빨라서 일본열도 내 이 유형의 찰갑은 금공(金工)갑주를 포함한 다른 갑주들처럼 제작 과정에 한반도의 영향을 고려해 볼 수 있다. 따라서 한반도에서 출토된 찰갑 중왜와 관련이 있거나 왜계 찰갑으로 보는 자료에 대해서는 향후 면밀한 재검토가 필요하다. 한편, 투구와 부속갑은 그간 한일 관계 연구 대상으로 적극적으로 검토되지 못하였다. 그러나 최근 자료가 증가하여 복발이나 장식을 덧댄 돌기부주나 금동장차양주, 부속갑 붕 경갑(頸甲)과 비갑(臂甲) 등 한반도에서 일본열도에 영향을 주었을 가능성이 큰 자료들이 확인된다. 본고는 한일 고분 출토 자료의 비교 분석에만 주력하였으나 향후 각국의 갑옷을 수용한 목적과 배경, 양국에 미친 영향 등이 검토되어야 한다."
123,고 대산만 지석묘 사회와 다호리 집단,이동희,호남고고학회,호남고고학보,2021,고 대산만 지석묘 사회와 다호리 집단,"본고에서 다루는 공간적 범위는 창원시 동읍·대산면 및 김해시 진영읍 일원이다. 이 지역은 고대사회에 고 대산만(古大山灣)으로, 동일한 소문화권을 형성하였다. 필자는 고 대산만을 대상으로 덕천리 유적 등의 지석묘 축조사회와 변한(弁韓) 소국(小國)의 수장층(首長) 무덤으로 추정되는 다호리 목관묘(木棺墓) 축조집단과의 유기적인 연결고리를 찾고자 하였다. 고 대산만은 지석묘 축조를 위해 인력이 동원되는 실질적인 범위인 1-2개 읍락(邑落) 규모의 공간이고, 이 규모는 변한(弁韓)·가야(加耶)사회의 1개 소국과도 연결된다. 고 대산만에서 지석묘의 밀집도가 가장 높고 대외 교류의 거점인 봉산리·용잠리 집단이 중심 취락으로 추정되며 초대형 지석묘인 덕천리 1호의 피장자는 거점취락과 연계되어 제사를 주관한 사제(司祭)로 보았다. 즉, 봉산리·용잠리 일대의 우두머리는 정치적인 수장(首長)이고 덕천리 1호로 대표되는 피장자는 공동체의 제의를 주관하는 제사장으로 추정하였다. 봉산리·용잠리 일대의 우두머리는 집단지향적인 수장이라는 점에서 다호리 1호묘와 같은 개인지향적인 수장과는 차별성이 있다. 점토대토기(세형동검)문화가 늦게 나타난 영남 동남부지역, 특히 창원·김해 일대에 거대한 묘역을 갖춘 지석묘는 초기철기시대로 편년되고 있다. 이 시기에 지석묘를 축조했던 집단은 새로운 이질적인 문화요소와 만나게 되는데 우두머리들은 개인의 능력과 사적 소유를 강조하는 새로운 이데올로기를 수용하기보다는 종래 사회구조를 지탱했던 공동체유형을 강화하는 방향을 선택하면서 덕천리 1호와 같은 대규모 묘역식 지석묘를 축조한 것으로 보인다. 즉, 고 대산만에서 종래 거점취락인 봉산리·용산리 일대 중심세력이 점토대토기문화 유입기에 덕천리에 별도의 제의공간을 만들고 기존 질서를 유지하려는 전략을 택한 것으로 파악된다. 한편, 다호리 집단의 주축 세력을 기원전 1세기(전반)대에 고조선 멸망 후 남하한 서북한계 유이민으로 보았다. 초기 목관묘를 조영한 집단은 이주민이겠지만 점차 토착 유력세력과의 혼인관계 등 화합을 통해 통합을 지향했으리라 본다. 덕천리 지석묘군의 늦은 단계(기원전 1세기대)의 매장주체부 및 유물과의 비교를 통하여 다호리세력과 덕천리 세력 간의 교류가 있었음을 알 수 있었다. 고 대산만의 거점 지석묘 집단과 다호리 세력은 모두 낙동강 수로를 통한 교역의 중심지로서 성장하였을 것이다."
124,해상교류를 통해 본 호남지역 마한 성립기 매장문화와 사회변동의 다양성,허진아,호남고고학회,호남고고학보,2021,해상교류를 통해 본 호남지역 마한 성립기 매장문화와 사회변동의 다양성,"본고의 목적은 호남지역 마한 성립기 매장문화가 지역권마다 어떻게 그리고 왜 다른지 설명하는 데 있다. 이를 위해 먼저 초기철기-원삼국시대 철기문화 유입의 역동성을 살펴 외래문화의 유입이 다원적·다발적으로 이루어졌음을 논하였다. 다음, 전환기 사회변동의 다양성을 살피기 위해 마한의 해상교역품이자 무덤부장품 가운데 하나인 유리구슬을 검토하여 외래문화 유입 단계를 설정하였다. 이를 토대로 성립기 무덤의 종류와 부장품을 분석하여 크게 4개 지역권에서 2단계에 걸친 사회변동이 이루어졌음을 확인하였다. 해상교류망의 변화와 접근성에 따라 사회변동의 과정과 그 결과물인 매장문화에서 동시기 지역권마다 세부적인 차이가 관찰되었다. 궁극적으로, 필자는 호남지역 마한사회 성립이 해상교류를 통해 다양한 철기문화가 유입되는 과정에서 다발적으로 이루어졌으며 그 전개과정 또한 지역에 따라 속도와 내용면에서 다양하므로, 마한의 사회정치적 발전을 이끌어낸 원동력 역시 다원적일 수 있음을 제안한다"
125,영산강유역권 마한 관련 유적의 최신 조사 성과와 의의,김낙중,호남고고학회,호남고고학보,2021,영산강유역권 마한 관련 유적의 최신 조사 성과와 의의,"이 글에서는 최근 이루어진 영산강유역권의 마한 사회와 관련된 발굴 조사 성과와 그것이 가지는 역사적인 의미를 정리하였다. 우선 초창기 한, 마한 조기·전기의 양상을 밝힐 수 있는 2세기 이전의 자료들이 점차 증가하면서 영산강유역의 마한세력도 동아시아 차원의 교류에 참여하며 성장한 것으로 추정할 수 있게 되었다. 마한의 성장과 변동은 백제 왕권의 그것과 연동되어 있지만 단지 백제만이 아니라 주변, 특히 왜와도 상당히 밀접한 관계가 있었음을 왜계 고분 등을 통해 짐작할 수 있다. 이것은 해양 교류의 관점에서 백제와 왜의 교섭 혹은 교류 과정에서 이 지역 마한세력이 중요한 역할을 수행할 여지가 생겼기 때문일 것이다. 한편 새로운 자료들이 발견되면서 특정 유물의 성격을 다시 논의해야 하는 상황도 생겼다. 대표적인 것이 원통형토기(분주토기)인데, 고창 왕촌리 유적 원통형토기, 함평 금산리와 영암 내동리 쌍무덤 출토 형상 하니와형 토제품 등을 통해 지역 사회의 네트워크, 왜(九州)와의 관계에 대해서도 다양한 관점에서 다시 논의할 필요성이 생겼다. 마지막으로 방대형 분구의 등장, 금동신발 및 금동관 등 위세품, 그리고 나주 송제리 고분군 등의 고고자료를 통해 백제와 영산강유역 세력의 관계 변화의 과정을 좀 더 촘촘하게 살펴볼 수 있게 되었고, 백제화 과정에서도 여전히 현지세력의 역할이 중요하였음을 인식할 수 있었다. 영산강유역은 초창기 韓부터 후기 마한까지 마한 변천의 전 단계를 살필 수 있는 곳이다. 이러한 양상은 영산강 본류역 뿐만 아니라 고창과 해남에서도 동일하게 보이므로 영산강유역권으로 묶어 함께 연구할 필요가 있다."
